{
 "protocols":[
  {
  "showname":"Frame 1: 395 bytes on wire (3160 bits), 395 bytes captured (3160 bits) on interface 1",
  "fields": [
   {
   "showname":"Interface id: 1"
  },
  {
   "showname":"Encapsulation type: Ethernet (1)"
  },
  {
   "showname":"Arrival Time: Aug 27, 2013 20:34:40.750405000 PDT"
  },
  {
   "showname":"[Time shift for this packet: 0.000000000 seconds]"
  },
  {
   "showname":"Epoch Time: 1377660880.750405000 seconds"
  },
  {
   "showname":"[Time delta from previous captured frame: 0.000000000 seconds]"
  },
  {
   "showname":"[Time delta from previous displayed frame: 0.000000000 seconds]"
  },
  {
   "showname":"[Time since reference or first frame: 0.000000000 seconds]"
  },
  {
   "showname":"Frame Number: 1"
  },
  {
   "showname":"Frame Length: 395 bytes (3160 bits)"
  },
  {
   "showname":"Capture Length: 395 bytes (3160 bits)"
  },
  {
   "showname":"[Frame is marked: False]"
  },
  {
   "showname":"[Frame is ignored: False]"
  },
  {
   "showname":"[Protocols in frame: eth:ip:tcp:http:media]"   }
  ]
 },
 {
  "showname":"Ethernet II, Src: 00:22:64:04:dd:b8 (00:22:64:04:dd:b8), Dst: 00:21:6a:6e:55:d4 (00:21:6a:6e:55:d4)",
  "fields": [
   {
   "showname":"Destination: 00:21:6a:6e:55:d4 (00:21:6a:6e:55:d4)",
   "fields": [
    {
    "showname":"Address: 00:21:6a:6e:55:d4 (00:21:6a:6e:55:d4)"
   },
   {
    "showname":".... ..0. .... .... .... .... = LG bit: Globally unique address (factory default)"
   },
   {
    "showname":".... ...0 .... .... .... .... = IG bit: Individual address (unicast)"    }
   ]
  },
  {
   "showname":"Source: 00:22:64:04:dd:b8 (00:22:64:04:dd:b8)",
   "fields": [
    {
    "showname":"Address: 00:22:64:04:dd:b8 (00:22:64:04:dd:b8)"
   },
   {
    "showname":".... ..0. .... .... .... .... = LG bit: Globally unique address (factory default)"
   },
   {
    "showname":".... ...0 .... .... .... .... = IG bit: Individual address (unicast)"    }
   ]
  },
  {
   "showname":"Type: IP (0x0800)"   }
  ]
 },
 {
  "showname":"Internet Protocol Version 4, Src: 8.19.34.214 (8.19.34.214), Dst: 169.234.120.26 (169.234.120.26)",
  "fields": [
   {
   "showname":"Version: 4"
  },
  {
   "showname":"Header length: 20 bytes"
  },
  {
   "showname":"Differentiated Services Field: 0x00 (DSCP 0x00: Default; ECN: 0x00: Not-ECT (Not ECN-Capable Transport))",
   "fields": [
    {
    "showname":"0000 00.. = Differentiated Services Codepoint: Default (0x00)"
   },
   {
    "showname":".... ..00 = Explicit Congestion Notification: Not-ECT (Not ECN-Capable Transport) (0x00)"    }
   ]
  },
  {
   "showname":"Total Length: 381"
  },
  {
   "showname":"Identification: 0xe367 (58215)"
  },
  {
   "showname":"Flags: 0x02 (Don't Fragment)",
   "fields": [
    {
    "showname":"0... .... = Reserved bit: Not set"
   },
   {
    "showname":".1.. .... = Don't fragment: Set"
   },
   {
    "showname":"..0. .... = More fragments: Not set"    }
   ]
  },
  {
   "showname":"Fragment offset: 0"
  },
  {
   "showname":"Time to live: 48"
  },
  {
   "showname":"Protocol: TCP (6)"
  },
  {
   "showname":"Header checksum: 0x1926 [correct]",
   "fields": [
    {
    "showname":"[Good: True]"
   },
   {
    "showname":"[Bad: False]"    }
   ]
  },
  {
   "showname":"Source: 8.19.34.214 (8.19.34.214)"
  },
  {
   "showname":"Destination: 169.234.120.26 (169.234.120.26)"   }
  ]
 },
 {
  "showname":"Transmission Control Protocol, Src Port: http (80), Dst Port: 52223 (52223), Seq: 1, Ack: 1, Len: 329",
  "fields": [
   {
   "showname":"Source port: http (80)"
  },
  {
   "showname":"Destination port: 52223 (52223)"
  },
  {
   "showname":"[Stream index: 0]"
  },
  {
   "showname":"[TCP Segment Len: 329]"
  },
  {
   "showname":"Sequence number: 1    (relative sequence number)"
  },
  {
   "showname":"[Next sequence number: 330    (relative sequence number)]"
  },
  {
   "showname":"Acknowledgment number: 1    (relative ack number)"
  },
  {
   "showname":"Header length: 32 bytes"
  },
  {
   "showname":"Flags: 0x018 (PSH, ACK)",
   "fields": [
    {
    "showname":"000. .... .... = Reserved: Not set"
   },
   {
    "showname":"...0 .... .... = Nonce: Not set"
   },
   {
    "showname":".... 0... .... = Congestion Window Reduced (CWR): Not set"
   },
   {
    "showname":".... .0.. .... = ECN-Echo: Not set"
   },
   {
    "showname":".... ..0. .... = Urgent: Not set"
   },
   {
    "showname":".... ...1 .... = Acknowledgment: Set"
   },
   {
    "showname":".... .... 1... = Push: Set"
   },
   {
    "showname":".... .... .0.. = Reset: Not set"
   },
   {
    "showname":".... .... ..0. = Syn: Not set"
   },
   {
    "showname":".... .... ...0 = Fin: Not set"    }
   ]
  },
  {
   "showname":"Window size value: 64436"
  },
  {
   "showname":"[Calculated window size: 64436]"
  },
  {
   "showname":"[Window size scaling factor: -1 (unknown)]"
  },
  {
   "showname":"Checksum: 0xcbfc [validation disabled]",
   "fields": [
    {
    "showname":"[Good Checksum: False]"
   },
   {
    "showname":"[Bad Checksum: False]"    }
   ]
  },
  {
   "showname":"Urgent pointer: 0"
  },
  {
   "showname":"Options: (12 bytes), No-Operation (NOP), No-Operation (NOP), Timestamps",
   "fields": [
    {
    "showname":"No-Operation (NOP)",
    "fields": [
     {
     "showname":"Type: 1",
     "fields": [
      {
      "showname":"0... .... = Copy on fragmentation: No"
     },
     {
      "showname":".00. .... = Class: Control (0)"
     },
     {
      "showname":"...0 0001 = Number: No-Operation (NOP) (1)"      "showname":"No-Operation (NOP)"      }
     ]
    },
    {
     "showname":"Type: 1",
     "fields": [
      {
      "showname":"0... .... = Copy on fragmentation: No"
     },
     {
      "showname":".00. .... = Class: Control (0)"
     },
     {
      "showname":"...0 0001 = Number: No-Operation (NOP) (1)"      "showname":"Timestamps: TSval 1630591089, TSecr 14741579"      }
     ]
    },
    {
     "showname":"Kind: Timestamp (8)"
    },
    {
     "showname":"Length: 10"
    },
    {
     "showname":"Timestamp value: 1630591089"
    },
    {
     "showname":"Timestamp echo reply: 14741579"     "showname":"[SEQ/ACK analysis]"     }
    ]
   },
   {
    "showname":"[Bytes in flight: 329]"    }
    ]
   }
    ]
   }
,
  {   "showname":"Hypertext Transfer Protocol"
  },
  {
   "showname":"HTTP/1.1 200 OK\r\n",
   "fields": [
    {
    "showname":"[Expert Info (Chat/Sequence): HTTP/1.1 200 OK\r\n]",
    "fields": [
     {
     "showname":"[HTTP/1.1 200 OK\r\n]"
    },
    {
     "showname":"[Severity level: Chat]"
    },
    {
     "showname":"[Group: Sequence]"     }
    ]
   },
   {
    "showname":"Request Version: HTTP/1.1"
   },
   {
    "showname":"Status Code: 200"
   },
   {
    "showname":"Response Phrase: OK"    }
   ]
  },
  {
   "showname":"Date: Wed, 28 Aug 2013 03:34:38 GMT\r\n"
  },
  {
   "showname":"Content-Type: application/javascript;charset=UTF-8\r\n"
  },
  {
   "showname":"Content-Length: 168\r\n",
   "fields": [
    {
    "showname":"[Content length: 168]"    }
   ]
  },
  {
   "showname":"Server: Jetty(7.3.0.v20110203)\r\n"
  },
  {
   "showname":"\r\n"
  },
  {
   "showname":"[HTTP response 1/1]"   }
  ]
 },
 {
  "showname":"Media Type",
  "fields": [
   {
   "showname":"Media Type: application/javascript; charset=UTF-8 (168 bytes)"   }
  ]
 },
 {
  "showname":""  {
  "showname":"Frame 2: 66 bytes on wire (528 bits), 66 bytes captured (528 bits) on interface 1",
  "fields": [
   {
   "showname":"Interface id: 1"
  },
  {
   "showname":"Encapsulation type: Ethernet (1)"
  },
  {
   "showname":"Arrival Time: Aug 27, 2013 20:34:40.750429000 PDT"
  },
  {
   "showname":"[Time shift for this packet: 0.000000000 seconds]"
  },
  {
   "showname":"Epoch Time: 1377660880.750429000 seconds"
  },
  {
   "showname":"[Time delta from previous captured frame: 0.000024000 seconds]"
  },
  {
   "showname":"[Time delta from previous displayed frame: 0.000024000 seconds]"
  },
  {
   "showname":"[Time since reference or first frame: 0.000024000 seconds]"
  },
  {
   "showname":"Frame Number: 2"
  },
  {
   "showname":"Frame Length: 66 bytes (528 bits)"
  },
  {
   "showname":"Capture Length: 66 bytes (528 bits)"
  },
  {
   "showname":"[Frame is marked: False]"
  },
  {
   "showname":"[Frame is ignored: False]"
  },
  {
   "showname":"[Protocols in frame: eth:ip:tcp]"   }
  ]
 },
 {
  "showname":"Ethernet II, Src: 00:21:6a:6e:55:d4 (00:21:6a:6e:55:d4), Dst: 00:22:64:04:dd:b8 (00:22:64:04:dd:b8)",
  "fields": [
   {
   "showname":"Destination: 00:22:64:04:dd:b8 (00:22:64:04:dd:b8)",
   "fields": [
    {
    "showname":"Address: 00:22:64:04:dd:b8 (00:22:64:04:dd:b8)"
   },
   {
    "showname":".... ..0. .... .... .... .... = LG bit: Globally unique address (factory default)"
   },
   {
    "showname":".... ...0 .... .... .... .... = IG bit: Individual address (unicast)"    }
   ]
  },
  {
   "showname":"Source: 00:21:6a:6e:55:d4 (00:21:6a:6e:55:d4)",
   "fields": [
    {
    "showname":"Address: 00:21:6a:6e:55:d4 (00:21:6a:6e:55:d4)"
   },
   {
    "showname":".... ..0. .... .... .... .... = LG bit: Globally unique address (factory default)"
   },
   {
    "showname":".... ...0 .... .... .... .... = IG bit: Individual address (unicast)"    }
   ]
  },
  {
   "showname":"Type: IP (0x0800)"   }
  ]
 },
 {
  "showname":"Internet Protocol Version 4, Src: 169.234.120.26 (169.234.120.26), Dst: 8.19.34.214 (8.19.34.214)",
  "fields": [
   {
   "showname":"Version: 4"
  },
  {
   "showname":"Header length: 20 bytes"
  },
  {
   "showname":"Differentiated Services Field: 0x00 (DSCP 0x00: Default; ECN: 0x00: Not-ECT (Not ECN-Capable Transport))",
   "fields": [
    {
    "showname":"0000 00.. = Differentiated Services Codepoint: Default (0x00)"
   },
   {
    "showname":".... ..00 = Explicit Congestion Notification: Not-ECT (Not ECN-Capable Transport) (0x00)"    }
   ]
  },
  {
   "showname":"Total Length: 52"
  },
  {
   "showname":"Identification: 0xe7d5 (59349)"
  },
  {
   "showname":"Flags: 0x02 (Don't Fragment)",
   "fields": [
    {
    "showname":"0... .... = Reserved bit: Not set"
   },
   {
    "showname":".1.. .... = Don't fragment: Set"
   },
   {
    "showname":"..0. .... = More fragments: Not set"    }
   ]
  },
  {
   "showname":"Fragment offset: 0"
  },
  {
   "showname":"Time to live: 64"
  },
  {
   "showname":"Protocol: TCP (6)"
  },
  {
   "showname":"Header checksum: 0x0601 [correct]",
   "fields": [
    {
    "showname":"[Good: True]"
   },
   {
    "showname":"[Bad: False]"    }
   ]
  },
  {
   "showname":"Source: 169.234.120.26 (169.234.120.26)"
  },
  {
   "showname":"Destination: 8.19.34.214 (8.19.34.214)"   }
  ]
 },
 {
  "showname":"Transmission Control Protocol, Src Port: 52223 (52223), Dst Port: http (80), Seq: 1, Ack: 330, Len: 0",
  "fields": [
   {
   "showname":"Source port: 52223 (52223)"
  },
  {
   "showname":"Destination port: http (80)"
  },
  {
   "showname":"[Stream index: 0]"
  },
  {
   "showname":"[TCP Segment Len: 0]"
  },
  {
   "showname":"Sequence number: 1    (relative sequence number)"
  },
  {
   "showname":"Acknowledgment number: 330    (relative ack number)"
  },
  {
   "showname":"Header length: 32 bytes"
  },
  {
   "showname":"Flags: 0x010 (ACK)",
   "fields": [
    {
    "showname":"000. .... .... = Reserved: Not set"
   },
   {
    "showname":"...0 .... .... = Nonce: Not set"
   },
   {
    "showname":".... 0... .... = Congestion Window Reduced (CWR): Not set"
   },
   {
    "showname":".... .0.. .... = ECN-Echo: Not set"
   },
   {
    "showname":".... ..0. .... = Urgent: Not set"
   },
   {
    "showname":".... ...1 .... = Acknowledgment: Set"
   },
   {
    "showname":".... .... 0... = Push: Not set"
   },
   {
    "showname":".... .... .0.. = Reset: Not set"
   },
   {
    "showname":".... .... ..0. = Syn: Not set"
   },
   {
    "showname":".... .... ...0 = Fin: Not set"    }
   ]
  },
  {
   "showname":"Window size value: 309"
  },
  {
   "showname":"[Calculated window size: 309]"
  },
  {
   "showname":"[Window size scaling factor: -1 (unknown)]"
  },
  {
   "showname":"Checksum: 0x4d14 [validation disabled]",
   "fields": [
    {
    "showname":"[Good Checksum: False]"
   },
   {
    "showname":"[Bad Checksum: False]"    }
   ]
  },
  {
   "showname":"Urgent pointer: 0"
  },
  {
   "showname":"Options: (12 bytes), No-Operation (NOP), No-Operation (NOP), Timestamps",
   "fields": [
    {
    "showname":"No-Operation (NOP)",
    "fields": [
     {
     "showname":"Type: 1",
     "fields": [
      {
      "showname":"0... .... = Copy on fragmentation: No"
     },
     {
      "showname":".00. .... = Class: Control (0)"
     },
     {
      "showname":"...0 0001 = Number: No-Operation (NOP) (1)"      "showname":"No-Operation (NOP)"      }
     ]
    },
    {
     "showname":"Type: 1",
     "fields": [
      {
      "showname":"0... .... = Copy on fragmentation: No"
     },
     {
      "showname":".00. .... = Class: Control (0)"
     },
     {
      "showname":"...0 0001 = Number: No-Operation (NOP) (1)"      "showname":"Timestamps: TSval 14741968, TSecr 1630591089"      }
     ]
    },
    {
     "showname":"Kind: Timestamp (8)"
    },
    {
     "showname":"Length: 10"
    },
    {
     "showname":"Timestamp value: 14741968"
    },
    {
     "showname":"Timestamp echo reply: 1630591089"     "showname":"[SEQ/ACK analysis]"     }
    ]
   },
   {
    "showname":"[This is an ACK to the segment in frame: 1]"
   },
   {
    "showname":"[The RTT to ACK the segment was: 0.000024000 seconds]"    }
    ]
   }
    ]
   }
,
  {   "showname":""   }
  ]
 },
 {
  "showname":"Frame 3: 436 bytes on wire (3488 bits), 436 bytes captured (3488 bits) on interface 1",
  "fields": [
   {
   "showname":"Interface id: 1"
  },
  {
   "showname":"Encapsulation type: Ethernet (1)"
  },
  {
   "showname":"Arrival Time: Aug 27, 2013 20:34:41.053314000 PDT"
  },
  {
   "showname":"[Time shift for this packet: 0.000000000 seconds]"
  },
  {
   "showname":"Epoch Time: 1377660881.053314000 seconds"
  },
  {
   "showname":"[Time delta from previous captured frame: 0.302885000 seconds]"
  },
  {
   "showname":"[Time delta from previous displayed frame: 0.302885000 seconds]"
  },
  {
   "showname":"[Time since reference or first frame: 0.302909000 seconds]"
  },
  {
   "showname":"Frame Number: 3"
  },
  {
   "showname":"Frame Length: 436 bytes (3488 bits)"
  },
  {
   "showname":"Capture Length: 436 bytes (3488 bits)"
  },
  {
   "showname":"[Frame is marked: False]"
  },
  {
   "showname":"[Frame is ignored: False]"
  },
  {
   "showname":"[Protocols in frame: eth:ip:tcp:http]"   }
  ]
 },
 {
  "showname":"Ethernet II, Src: 00:21:6a:6e:55:d4 (00:21:6a:6e:55:d4), Dst: 00:22:64:04:dd:b8 (00:22:64:04:dd:b8)",
  "fields": [
   {
   "showname":"Destination: 00:22:64:04:dd:b8 (00:22:64:04:dd:b8)",
   "fields": [
    {
    "showname":"Address: 00:22:64:04:dd:b8 (00:22:64:04:dd:b8)"
   },
   {
    "showname":".... ..0. .... .... .... .... = LG bit: Globally unique address (factory default)"
   },
   {
    "showname":".... ...0 .... .... .... .... = IG bit: Individual address (unicast)"    }
   ]
  },
  {
   "showname":"Source: 00:21:6a:6e:55:d4 (00:21:6a:6e:55:d4)",
   "fields": [
    {
    "showname":"Address: 00:21:6a:6e:55:d4 (00:21:6a:6e:55:d4)"
   },
   {
    "showname":".... ..0. .... .... .... .... = LG bit: Globally unique address (factory default)"
   },
   {
    "showname":".... ...0 .... .... .... .... = IG bit: Individual address (unicast)"    }
   ]
  },
  {
   "showname":"Type: IP (0x0800)"   }
  ]
 },
 {
  "showname":"Internet Protocol Version 4, Src: 169.234.120.26 (169.234.120.26), Dst: 8.19.34.214 (8.19.34.214)",
  "fields": [
   {
   "showname":"Version: 4"
  },
  {
   "showname":"Header length: 20 bytes"
  },
  {
   "showname":"Differentiated Services Field: 0x00 (DSCP 0x00: Default; ECN: 0x00: Not-ECT (Not ECN-Capable Transport))",
   "fields": [
    {
    "showname":"0000 00.. = Differentiated Services Codepoint: Default (0x00)"
   },
   {
    "showname":".... ..00 = Explicit Congestion Notification: Not-ECT (Not ECN-Capable Transport) (0x00)"    }
   ]
  },
  {
   "showname":"Total Length: 422"
  },
  {
   "showname":"Identification: 0xe7d6 (59350)"
  },
  {
   "showname":"Flags: 0x02 (Don't Fragment)",
   "fields": [
    {
    "showname":"0... .... = Reserved bit: Not set"
   },
   {
    "showname":".1.. .... = Don't fragment: Set"
   },
   {
    "showname":"..0. .... = More fragments: Not set"    }
   ]
  },
  {
   "showname":"Fragment offset: 0"
  },
  {
   "showname":"Time to live: 64"
  },
  {
   "showname":"Protocol: TCP (6)"
  },
  {
   "showname":"Header checksum: 0x048e [correct]",
   "fields": [
    {
    "showname":"[Good: True]"
   },
   {
    "showname":"[Bad: False]"    }
   ]
  },
  {
   "showname":"Source: 169.234.120.26 (169.234.120.26)"
  },
  {
   "showname":"Destination: 8.19.34.214 (8.19.34.214)"   }
  ]
 },
 {
  "showname":"Transmission Control Protocol, Src Port: 52223 (52223), Dst Port: http (80), Seq: 1, Ack: 330, Len: 370",
  "fields": [
   {
   "showname":"Source port: 52223 (52223)"
  },
  {
   "showname":"Destination port: http (80)"
  },
  {
   "showname":"[Stream index: 0]"
  },
  {
   "showname":"[TCP Segment Len: 370]"
  },
  {
   "showname":"Sequence number: 1    (relative sequence number)"
  },
  {
   "showname":"[Next sequence number: 371    (relative sequence number)]"
  },
  {
   "showname":"Acknowledgment number: 330    (relative ack number)"
  },
  {
   "showname":"Header length: 32 bytes"
  },
  {
   "showname":"Flags: 0x018 (PSH, ACK)",
   "fields": [
    {
    "showname":"000. .... .... = Reserved: Not set"
   },
   {
    "showname":"...0 .... .... = Nonce: Not set"
   },
   {
    "showname":".... 0... .... = Congestion Window Reduced (CWR): Not set"
   },
   {
    "showname":".... .0.. .... = ECN-Echo: Not set"
   },
   {
    "showname":".... ..0. .... = Urgent: Not set"
   },
   {
    "showname":".... ...1 .... = Acknowledgment: Set"
   },
   {
    "showname":".... .... 1... = Push: Set"
   },
   {
    "showname":".... .... .0.. = Reset: Not set"
   },
   {
    "showname":".... .... ..0. = Syn: Not set"
   },
   {
    "showname":".... .... ...0 = Fin: Not set"    }
   ]
  },
  {
   "showname":"Window size value: 311"
  },
  {
   "showname":"[Calculated window size: 311]"
  },
  {
   "showname":"[Window size scaling factor: -1 (unknown)]"
  },
  {
   "showname":"Checksum: 0xa8a6 [validation disabled]",
   "fields": [
    {
    "showname":"[Good Checksum: False]"
   },
   {
    "showname":"[Bad Checksum: False]"    }
   ]
  },
  {
   "showname":"Urgent pointer: 0"
  },
  {
   "showname":"Options: (12 bytes), No-Operation (NOP), No-Operation (NOP), Timestamps",
   "fields": [
    {
    "showname":"No-Operation (NOP)",
    "fields": [
     {
     "showname":"Type: 1",
     "fields": [
      {
      "showname":"0... .... = Copy on fragmentation: No"      "showname":"3             .00. .... = Class: Control (0)"
     },
     {
      "showname":"...0 0001 = Number: No-Operation (NOP) (1)"      "showname":"No-Operation (NOP)"      }
     ]
    },
    {
     "showname":"Type: 1",
     "fields": [
      {
      "showname":"0... .... = Copy on fragmentation: No"
     },
     {
      "showname":".00. .... = Class: Control (0)"
     },
     {
      "showname":"...0 0001 = Number: No-Operation (NOP) (1)"      "showname":"Timestamps: TSval 14742043, TSecr 1630591089"      }
     ]
    },
    {
     "showname":"Kind: Timestamp (8)"
    },
    {
     "showname":"Length: 10"
    },
    {
     "showname":"Timestamp value: 14742043"
    },
    {
     "showname":"Timestamp echo reply: 1630591089"     "showname":"[SEQ/ACK analysis]"     }
    ]
   },
   {
    "showname":"[Bytes in flight: 370]"    }
    ]
   }
    ]
   }
,
  {   "showname":"Hypertext Transfer Protocol"
  },
  {
   "showname":"GET /fromserver2?s=-1323823685&a=zj20SZqNaJ5HfK HTTP/1.1\r\n",
   "fields": [
    {
    "showname":"[Expert Info (Chat/Sequence): GET /fromserver2?s=-1323823685&a=zj20SZqNaJ5HfK HTTP/1.1\r\n]",
    "fields": [
     {
     "showname":"[GET /fromserver2?s=-1323823685&a=zj20SZqNaJ5HfK HTTP/1.1\r\n]"
    },
    {
     "showname":"[Severity level: Chat]"
    },
    {
     "showname":"[Group: Sequence]"     }
    ]
   },
   {
    "showname":"Request Method: GET"
   },
   {
    "showname":"Request URI: /fromserver2?s=-1323823685&a=zj20SZqNaJ5HfK"
   },
   {
    "showname":"Request Version: HTTP/1.1"    }
   ]
  },
  {
   "showname":"Host: edge6rx2.envolve.com\r\n"
  },
  {
   "showname":"User-Agent: Mozilla/5.0 (X11; Ubuntu; Linux i686; rv:22.0) Gecko/20100101 Firefox/22.0\r\n"
  },
  {
   "showname":"Accept: */*\r\n"
  },
  {
   "showname":"Accept-Language: en-US,en;q=0.5\r\n"
  },
  {
   "showname":"Accept-Encoding: gzip, deflate\r\n"
  },
  {
   "showname":"Referer: http://www.careercup.com/page?pid=software-engineer-developer-interview-questions\r\n"
  },
  {
   "showname":"Connection: keep-alive\r\n"
  },
  {
   "showname":"\r\n"
  },
  {
   "showname":"[Full request URI: http://edge6rx2.envolve.com/fromserver2?s=-1323823685&a=zj20SZqNaJ5HfK]"
  },
  {
   "showname":"[HTTP request 2/2]"   }
  ]
 },
 {
  "showname":""  {
  "showname":"Frame 4: 66 bytes on wire (528 bits), 66 bytes captured (528 bits) on interface 1",
  "fields": [
   {
   "showname":"Interface id: 1"
  },
  {
   "showname":"Encapsulation type: Ethernet (1)"
  },
  {
   "showname":"Arrival Time: Aug 27, 2013 20:34:41.175475000 PDT"
  },
  {
   "showname":"[Time shift for this packet: 0.000000000 seconds]"
  },
  {
   "showname":"Epoch Time: 1377660881.175475000 seconds"
  },
  {
   "showname":"[Time delta from previous captured frame: 0.122161000 seconds]"
  },
  {
   "showname":"[Time delta from previous displayed frame: 0.122161000 seconds]"
  },
  {
   "showname":"[Time since reference or first frame: 0.425070000 seconds]"
  },
  {
   "showname":"Frame Number: 4"
  },
  {
   "showname":"Frame Length: 66 bytes (528 bits)"
  },
  {
   "showname":"Capture Length: 66 bytes (528 bits)"
  },
  {
   "showname":"[Frame is marked: False]"
  },
  {
   "showname":"[Frame is ignored: False]"
  },
  {
   "showname":"[Protocols in frame: eth:ip:tcp]"   }
  ]
 },
 {
  "showname":"Ethernet II, Src: 00:22:64:04:dd:b8 (00:22:64:04:dd:b8), Dst: 00:21:6a:6e:55:d4 (00:21:6a:6e:55:d4)",
  "fields": [
   {
   "showname":"Destination: 00:21:6a:6e:55:d4 (00:21:6a:6e:55:d4)",
   "fields": [
    {
    "showname":"Address: 00:21:6a:6e:55:d4 (00:21:6a:6e:55:d4)"
   },
   {
    "showname":".... ..0. .... .... .... .... = LG bit: Globally unique address (factory default)"
   },
   {
    "showname":".... ...0 .... .... .... .... = IG bit: Individual address (unicast)"    }
   ]
  },
  {
   "showname":"Source: 00:22:64:04:dd:b8 (00:22:64:04:dd:b8)",
   "fields": [
    {
    "showname":"Address: 00:22:64:04:dd:b8 (00:22:64:04:dd:b8)"
   },
   {
    "showname":".... ..0. .... .... .... .... = LG bit: Globally unique address (factory default)"
   },
   {
    "showname":".... ...0 .... .... .... .... = IG bit: Individual address (unicast)"    }
   ]
  },
  {
   "showname":"Type: IP (0x0800)"   }
  ]
 },
 {
  "showname":"Internet Protocol Version 4, Src: 8.19.34.214 (8.19.34.214), Dst: 169.234.120.26 (169.234.120.26)",
  "fields": [
   {
   "showname":"Version: 4"
  },
  {
   "showname":"Header length: 20 bytes"
  },
  {
   "showname":"Differentiated Services Field: 0x00 (DSCP 0x00: Default; ECN: 0x00: Not-ECT (Not ECN-Capable Transport))",
   "fields": [
    {
    "showname":"0000 00.. = Differentiated Services Codepoint: Default (0x00)"
   },
   {
    "showname":".... ..00 = Explicit Congestion Notification: Not-ECT (Not ECN-Capable Transport) (0x00)"    }
   ]
  },
  {
   "showname":"Total Length: 52"
  },
  {
   "showname":"Identification: 0xe6e2 (59106)"
  },
  {
   "showname":"Flags: 0x02 (Don't Fragment)",
   "fields": [
    {
    "showname":"0... .... = Reserved bit: Not set"
   },
   {
    "showname":".1.. .... = Don't fragment: Set"
   },
   {
    "showname":"..0. .... = More fragments: Not set"    }
   ]
  },
  {
   "showname":"Fragment offset: 0"
  },
  {
   "showname":"Time to live: 48"
  },
  {
   "showname":"Protocol: TCP (6)"
  },
  {
   "showname":"Header checksum: 0x16f4 [correct]",
   "fields": [
    {
    "showname":"[Good: True]"
   },
   {
    "showname":"[Bad: False]"    }
   ]
  },
  {
   "showname":"Source: 8.19.34.214 (8.19.34.214)"
  },
  {
   "showname":"Destination: 169.234.120.26 (169.234.120.26)"   }
  ]
 },
 {
  "showname":"Transmission Control Protocol, Src Port: http (80), Dst Port: 52223 (52223), Seq: 330, Ack: 371, Len: 0",
  "fields": [
   {
   "showname":"Source port: http (80)"
  },
  {
   "showname":"Destination port: 52223 (52223)"
  },
  {
   "showname":"[Stream index: 0]"
  },
  {
   "showname":"[TCP Segment Len: 0]"
  },
  {
   "showname":"Sequence number: 330    (relative sequence number)"
  },
  {
   "showname":"Acknowledgment number: 371    (relative ack number)"
  },
  {
   "showname":"Header length: 32 bytes"
  },
  {
   "showname":"Flags: 0x010 (ACK)4 5",
   "fields": [
    {
    "showname":"000. .... .... = Reserved: Not set"
   },
   {
    "showname":"...0 .... .... = Nonce: Not set"
   },
   {
    "showname":".... 0... .... = Congestion Window Reduced (CWR): Not set"
   },
   {
    "showname":".... .0.. .... = ECN-Echo: Not set"
   },
   {
    "showname":".... ..0. .... = Urgent: Not set"
   },
   {
    "showname":".... ...1 .... = Acknowledgment: Set"
   },
   {
    "showname":".... .... 0... = Push: Not set"
   },
   {
    "showname":".... .... .0.. = Reset: Not set"
   },
   {
    "showname":".... .... ..0. = Syn: Not set"
   },
   {
    "showname":".... .... ...0 = Fin: Not set"    }
   ]
  },
  {
   "showname":"Window size value: 64436"
  },
  {
   "showname":"[Calculated window size: 64436]"
  },
  {
   "showname":"[Window size scaling factor: -1 (unknown)]"
  },
  {
   "showname":"Checksum: 0x0801 [validation disabled]",
   "fields": [
    {
    "showname":"[Good Checksum: False]"
   },
   {
    "showname":"[Bad Checksum: False]"    }
   ]
  },
  {
   "showname":"Urgent pointer: 0"
  },
  {
   "showname":"Options: (12 bytes), No-Operation (NOP), No-Operation (NOP), Timestamps",
   "fields": [
    {
    "showname":"No-Operation (NOP)",
    "fields": [
     {
     "showname":"Type: 1",
     "fields": [
      {
      "showname":"0... .... = Copy on fragmentation: No"
     },
     {
      "showname":".00. .... = Class: Control (0)"
     },
     {
      "showname":"...0 0001 = Number: No-Operation (NOP) (1)"      "showname":"No-Operation (NOP)"      }
     ]
    },
    {
     "showname":"Type: 1",
     "fields": [
      {
      "showname":"0... .... = Copy on fragmentation: No"
     },
     {
      "showname":".00. .... = Class: Control (0)"
     },
     {
      "showname":"...0 0001 = Number: No-Operation (NOP) (1)"      "showname":"Timestamps: TSval 1630591132, TSecr 14742043"      }
     ]
    },
    {
     "showname":"Kind: Timestamp (8)"
    },
    {
     "showname":"Length: 10"
    },
    {
     "showname":"Timestamp value: 1630591132"
    },
    {
     "showname":"Timestamp echo reply: 14742043"     "showname":"[SEQ/ACK analysis]"     }
    ]
   },
   {
    "showname":"[This is an ACK to the segment in frame: 3]"
   },
   {
    "showname":"[The RTT to ACK the segment was: 0.122161000 seconds]"    }
    ]
   }
    ]
   }
,
  {   "showname":""   }
  ]
 },
 {
  "showname":"Frame 5: 60 bytes on wire (480 bits), 60 bytes captured (480 bits) on interface 1",
  "fields": [
   {
   "showname":"Interface id: 1"
  },
  {
   "showname":"Encapsulation type: Ethernet (1)"
  },
  {
   "showname":"Arrival Time: Aug 27, 2013 20:34:42.012772000 PDT"
  },
  {
   "showname":"[Time shift for this packet: 0.000000000 seconds]"
  },
  {
   "showname":"Epoch Time: 1377660882.012772000 seconds"
  },
  {
   "showname":"[Time delta from previous captured frame: 0.837297000 seconds]"
  },
  {
   "showname":"[Time delta from previous displayed frame: 0.837297000 seconds]"
  },
  {
   "showname":"[Time since reference or first frame: 1.262367000 seconds]"
  },
  {
   "showname":"Frame Number: 5"
  },
  {
   "showname":"Frame Length: 60 bytes (480 bits)"
  },
  {
   "showname":"Capture Length: 60 bytes (480 bits)"
  },
  {
   "showname":"[Frame is marked: False]"
  },
  {
   "showname":"[Frame is ignored: False]"
  },
  {
   "showname":"[Protocols in frame: eth:llc:stp]"   }
  ]
 },
 {
  "showname":"IEEE 802.3 Ethernet",
  "fields": [
   {
   "showname":"Destination: 01:80:c2:00:00:00 (01:80:c2:00:00:00)",
   "fields": [
    {
    "showname":"Address: 01:80:c2:00:00:00 (01:80:c2:00:00:00)"
   },
   {
    "showname":".... ..0. .... .... .... .... = LG bit: Globally unique address (factory default)"
   },
   {
    "showname":".... ...1 .... .... .... .... = IG bit: Group address (multicast/broadcast)"    }
   ]
  },
  {
   "showname":"Source: 00:19:e8:bd:5f:88 (00:19:e8:bd:5f:88)",
   "fields": [
    {
    "showname":"Address: 00:19:e8:bd:5f:88 (00:19:e8:bd:5f:88)"
   },
   {
    "showname":".... ..0. .... .... .... .... = LG bit: Globally unique address (factory default)"
   },
   {
    "showname":".... ...0 .... .... .... .... = IG bit: Individual address (unicast)"    }
   ]
  },
  {
   "showname":"Length: 46"   }
  ]
 },
 {
  "showname":"Logical-Link Control",
  "fields": [
   {
   "showname":"DSAP: Spanning Tree BPDU (0x42)"
  },
  {
   "showname":"IG Bit: Individual"
  },
  {
   "showname":"SSAP: Spanning Tree BPDU (0x42)"
  },
  {
   "showname":"CR Bit: Command"
  },
  {
   "showname":"Control field: U, func=UI (0x03)",
   "fields": [
    {
    "showname":"000. 00.. = Command: Unnumbered Information (0x00)"
   },
   {
    "showname":".... ..11 = Frame type: Unnumbered frame (0x03)"    }
    ]
   }
    ]
   }
,
  {   "showname":"Spanning Tree Protocol"
  },
  {
   "showname":"Protocol Identifier: Spanning Tree Protocol (0x0000)"
  },
  {
   "showname":"Protocol Version Identifier: Spanning Tree (0)"
  },
  {
   "showname":"BPDU Type: Configuration (0x00)"
  },
  {
   "showname":"BPDU flags: 0x00",
   "fields": [
    {
    "showname":"0... .... = Topology Change Acknowledgment: No"
   },
   {
    "showname":".... ...0 = Topology Change: No"    }
   ]
  },
  {
   "showname":"Root Identifier: 32768 / 1201 / 00:0f:f8:27:11:80",
   "fields": [
    {
    "showname":"Root Bridge Priority: 32768"
   },
   {
    "showname":"Root Bridge System ID Extension: 1201"
   },
   {
    "showname":"Root Bridge System ID: 00:0f:f8:27:11:80 (00:0f:f8:27:11:80)"    }
   ]
  },
  {
   "showname":"Root Path Cost: 8"
  },
  {
   "showname":"Bridge Identifier: 32768 / 1201 / 00:19:e8:bd:5f:80",
   "fields": [
    {
    "showname":"Bridge Priority: 32768"
   },
   {
    "showname":"Bridge System ID Extension: 1201"
   },
   {
    "showname":"Bridge System ID: 00:19:e8:bd:5f:80 (00:19:e8:bd:5f:80)"    }
   ]
  },
  {
   "showname":"Port identifier: 0x8008"
  },
  {
   "showname":"Message Age: 3"
  },
  {
   "showname":"Max Age: 20"
  },
  {
   "showname":"Hello Time: 2"
  },
  {
   "showname":"Forward Delay: 15"   }
  ]
 },
 {
  "showname":""  {
  "showname":"Frame 6: 60 bytes on wire (480 bits), 60 bytes captured (480 bits) on interface 1",
  "fields": [
   {
   "showname":"Interface id: 1"
  },
  {
   "showname":"Encapsulation type: Ethernet (1)"
  },
  {
   "showname":"Arrival Time: Aug 27, 2013 20:34:42.626813000 PDT"
  },
  {
   "showname":"[Time shift for this packet: 0.0000006 000 seconds]"
  },
  {
   "showname":"Epoch Time: 1377660882.626813000 seconds"
  },
  {
   "showname":"[Time delta from previous captured frame: 0.614041000 seconds]"
  },
  {
   "showname":"[Time delta from previous displayed frame: 0.614041000 seconds]"
  },
  {
   "showname":"[Time since reference or first frame: 1.876408000 seconds]"
  },
  {
   "showname":"Frame Number: 6"
  },
  {
   "showname":"Frame Length: 60 bytes (480 bits)"
  },
  {
   "showname":"Capture Length: 60 bytes (480 bits)"
  },
  {
   "showname":"[Frame is marked: False]"
  },
  {
   "showname":"[Frame is ignored: False]"
  },
  {
   "showname":"[Protocols in frame: eth:ip:udp:bjnp]"   }
  ]
 },
 {
  "showname":"Ethernet II, Src: 00:22:64:04:dd:b8 (00:22:64:04:dd:b8), Dst: ff:ff:ff:ff:ff:ff (ff:ff:ff:ff:ff:ff)",
  "fields": [
   {
   "showname":"Destination: ff:ff:ff:ff:ff:ff (ff:ff:ff:ff:ff:ff)",
   "fields": [
    {
    "showname":"Address: ff:ff:ff:ff:ff:ff (ff:ff:ff:ff:ff:ff)"
   },
   {
    "showname":".... ..1. .... .... .... .... = LG bit: Locally administered address (this is NOT the factory default)"
   },
   {
    "showname":".... ...1 .... .... .... .... = IG bit: Group address (multicast/broadcast)"    }
   ]
  },
  {
   "showname":"Source: 00:22:64:04:dd:b8 (00:22:64:04:dd:b8)",
   "fields": [
    {
    "showname":"Address: 00:22:64:04:dd:b8 (00:22:64:04:dd:b8)"
   },
   {
    "showname":".... ..0. .... .... .... .... = LG bit: Globally unique address (factory default)"
   },
   {
    "showname":".... ...0 .... .... .... .... = IG bit: Individual address (unicast)"    }
   ]
  },
  {
   "showname":"Type: IP (0x0800)"
  },
  {
   "showname":"Padding: 3432"   }
  ]
 },
 {
  "showname":"Internet Protocol Version 4, Src: 169.234.120.98 (169.234.120.98), Dst: 169.234.120.127 (169.234.120.127)",
  "fields": [
   {
   "showname":"Version: 4"
  },
  {
   "showname":"Header length: 20 bytes"
  },
  {
   "showname":"Differentiated Services Field: 0x00 (DSCP 0x00: Default; ECN: 0x00: Not-ECT (Not ECN-Capable Transport))",
   "fields": [
    {
    "showname":"0000 00.. = Differentiated Services Codepoint: Default (0x00)"
   },
   {
    "showname":".... ..00 = Explicit Congestion Notification: Not-ECT (Not ECN-Capable Transport) (0x00)"    }
   ]
  },
  {
   "showname":"Total Length: 44"
  },
  {
   "showname":"Identification: 0xcc68 (52328)"
  },
  {
   "showname":"Flags: 0x00",
   "fields": [
    {
    "showname":"0... .... = Reserved bit: Not set"
   },
   {
    "showname":".0.. .... = Don't fragment: Not set"
   },
   {
    "showname":"..0. .... = More fragments: Not set"    }
   ]
  },
  {
   "showname":"Fragment offset: 0"
  },
  {
   "showname":"Time to live: 64"
  },
  {
   "showname":"Protocol: UDP (17)"
  },
  {
   "showname":"Header checksum: 0x69a2 [correct]",
   "fields": [
    {
    "showname":"[Good: True]"
   },
   {
    "showname":"[Bad: False]"    }
   ]
  },
  {
   "showname":"Source: 169.234.120.98 (169.234.120.98)"
  },
  {
   "showname":"Destination: 169.234.120.127 (169.234.120.127)"   }
  ]
 },
 {
  "showname":"User Datagram Protocol, Src Port: 56781 (56781), Dst Port: 8612 (8612)",
  "fields": [
   {
   "showname":"Source port: 56781 (56781)"
  },
  {
   "showname":"Destination port: 8612 (8612)"
  },
  {
   "showname":"Length: 24"
  },
  {
   "showname":"Checksum: 0x28fa [validation disabled]",
   "fields": [
    {
    "showname":"[Good Checksum: False]"
   },
   {
    "showname":"[Bad Checksum: False]"    }
    ]
   }
    ]
   }
,
  {   "showname":"Canon BJNP, Scanner Command: Discover"
  },
  {
   "showname":"Id: BJNP"
  },
  {
   "showname":"Type: Scanner Command (2)"
  },
  {
   "showname":"Code: Discover (1)"
  },
  {
   "showname":"Sequence Number: 0"
  },
  {
   "showname":"Session Id: 0"
  },
  {
   "showname":"Payload Length: 0"   }
  ]
 },
 {
  "showname":""  {
  "showname":"Frame 7: 60 bytes on wire (480 bits), 60 bytes captured (480 bits) on interface 1",
  "fields": [
   {
   "showname":"Interface id: 1"
  },
  {
   "showname":"Encapsulation type: Ethernet (1)"
  },
  {
   "showname":"Arrival Time: Aug 27, 2013 20:34:43.955968000 PDT"
  },
  {
   "showname":"[Time shift for this packet: 0.000000000 seconds]"
  },
  {
   "showname":"Epoch Time: 1377660883.955968000 seconds"
  },
  {
   "showname":"[Time delta from previous captured frame: 1.329155000 seconds]"
  },
  {
   "showname":"[Time delta from previous displayed frame: 1.329155000 seconds]"
  },
  {
   "showname":"[Time since reference or first frame: 3.205563000 seconds]"
  },
  {
   "showname":"Frame Number: 7"
  },
  {
   "showname":"Frame Length: 60 bytes (480 bits)"
  },
  {
   "showname":"Capture Length: 60 bytes (480 bits)"
  },
  {
   "showname":"[Frame is marked: False]"
  },
  {
   "showname":"[Frame is ignored: False]"
  },
  {
   "showname":"[Protocols in frame: eth:llc:stp]"   }
  ]
 },
 {
  "showname":"IEEE 802.3 Ethernet",
  "fields": [
   {
   "showname":"Destination: 01:80:c2:00:00:00 (01:80:c2:00:00:00)",
   "fields": [
    {
    "showname":"Address: 01:80:c2:00:00:00 (01:80:c2:00:00:00)"
   },
   {
    "showname":".... ..0. .... .... .... .... = LG bit: Globally unique address (factory default)"
   },
   {
    "showname":".... ...1 .... .... .... .... = IG bit: Group address (multicast/broadcast)"    }
   ]
  },
  {
   "showname":"Source: 00:19:e8:bd:5f:88 (00:19:e8:bd:5f:88)",
   "fields": [
    {
    "showname":"Address: 00:19:e8:bd:5f:88 (00:19:e8:bd:5f:88)"
   },
   {
    "showname":".... ..0. .... .... .... .... = LG bit: Globally unique address (factory default)"
   },
   {
    "showname":".... ...0 .... .... .... .... = IG bit: Individual address (unicast)"    }
   ]
  },
  {
   "showname":"Length: 46"   }
  ]
 },
 {
  "showname":"Logical-Link Control",
  "fields": [
   {
   "showname":"DSAP: Spanning Tree BPDU (0x42)"
  },
  {
   "showname":"IG Bit: Individual"
  },
  {
   "showname":"SSAP: Spanning Tree BPDU (0x42)"
  },
  {
   "showname":"CR Bit: Command"
  },
  {
   "showname":"Control field: U, func=UI (0x03)",
   "fields": [
    {
    "showname":"000. 00.. = Command: Unnumbered Information (0x00)"
   },
   {
    "showname":".... ..11 = Frame type: Unnumbered frame (0x03)"    }
    ]
   }
    ]
   }
,
  {   "showname":"Spanning Tree Protocol"
  },
  {
   "showname":"Protocol Identifier: Spanning Tree Protocol (0x0000)"
  },
  {
   "showname":"Protocol Version Identifier: Spanning Tree (0)"
  },
  {
   "showname":"BPDU Type: Configuration (0x00)"
  },
  {
   "showname":"BPDU flags: 0x00",
   "fields": [
    {
    "showname":"0... .... = Topology Change Acknowledgment: No"
   },
   {
    "showname":".... ...0 = Topology Change: No"    }
   ]
  },
  {
   "showname":"Root Identifier: 32768 / 1201 / 00:0f:f8:27:11:80",
   "fields": [
    {
    "showname":"Root Bridge Priority: 32768"
   },
   {
    "showname":"Root Bridge System ID Extension: 1201"
   },
   {
    "showname":"Root Bridge System ID: 00:0f:f8:27:11:80 (00:0f:f8:27:11:80)"    }
   ]
  },
  {
   "showname":"Root Path Cost: 8"
  },
  {
   "showname":"Bridge Identifier: 32768 / 1201 / 00:19:e8:bd:5f:80",
   "fields": [
    {
    "showname":"Bridge Priority: 32768"
   },
   {
    "showname":"Bridge System ID Extension: 1201"
   },
   {
    "showname":"Bridge System ID: 00:19:e8:bd:5f:80 (00:19:e8:bd:5f:80)"    }
   ]
  },
  {
   "showname":"Port identifier: 0x8008"
  },
  {
   "showname":"Message Age: 3"
  },
  {
   "showname":"Max Age: 20"
  },
  {
   "showname":"Hello Time: 2"
  },
  {
   "showname":"Forward Delay: 15"   }
  ]
 },
 {
  "showname":""  {
  "showname":"Frame 8: 391 bytes on wire (3128 bits), 391 bytes captured (3128 bits) on interface 1",
  "fields": [
   {
   "showname":"Interface id: 1"
  },
  {
   "showname":"Encapsulation type: Ethernet (1)"
  },
  {
   "showname":"Arrival Time: Aug 27, 2013 20:34:44.192723000 PDT"
  },
  {
   "showname":"[Time shift for this packet: 0.000000000 seconds]"
  },
  {
   "showname":"Epoch Time: 1377660884.192723000 seconds"
  },
  {
   "showname":"[Time delta from previous captured frame: 0.236755000 seconds]"
  },
  {
   "showname":"[Time delta from previous displayed frame: 0.236755000 seconds]"
  },
  {
   "showname":"[Time since reference or first frame: 3.442318000 seconds]"
  },
  {
   "showname":"Frame Number: 8"
  },
  {
   "showname":"Frame Length: 391 bytes (3128 bits)"
  },
  {
   "showname":"Capture Length: 391 bytes (3128 bits)"
  },
  {
   "showname":"[Frame is marked: False]"
  },
  {
   "showname":"[Frame is ignored: False]"
  },
  {
