{
"protocols": [
{
"showname": "Frame 1: 92 bytes on wire (736 bits), 92 bytes captured (736 bits) on interface 0",
"fields": [
{
"showname": "Interface id: 0"
},
{
"showname": "Encapsulation type: Ethernet (1)"
},
{
"showname": "Arrival Time: Sep 16, 2013 20:41:01.995017000 PDT"
},
{
"showname": "[Time shift for this packet: 0.000000000 seconds]"
},
{
"showname": "Epoch Time: 1379389261.995017000 seconds"
},
{
"showname": "[Time delta from previous captured frame: 0.000000000 seconds]"
},
{
"showname": "[Time delta from previous displayed frame: 0.000000000 seconds]"
},
{
"showname": "[Time since reference or first frame: 0.000000000 seconds]"
},
{
"showname": "Frame Number: 1"
},
{
"showname": "Frame Length: 92 bytes (736 bits)"
},
{
"showname": "Capture Length: 92 bytes (736 bits)"
},
{
"showname": "[Frame is marked: False]"
},
{
"showname": "[Frame is ignored: False]"
},
{
"showname": "[Protocols in frame: eth:ip:udp:nbns]"
}
]
},
{
"showname": "Ethernet II, Src: 1c:65:9d:1f:e0:f3 (1c:65:9d:1f:e0:f3), Dst: ff:ff:ff:ff:ff:ff (ff:ff:ff:ff:ff:ff)",
"fields": [
{
"showname": "Destination: ff:ff:ff:ff:ff:ff (ff:ff:ff:ff:ff:ff)",
"fields": [
{
"showname": "Address: ff:ff:ff:ff:ff:ff (ff:ff:ff:ff:ff:ff)"
},
{
"showname": ".... ..1. .... .... .... .... = LG bit: Locally administered address (this is NOT the factory default)"
},
{
"showname": ".... ...1 .... .... .... .... = IG bit: Group address (multicast/broadcast)"
}
]
},
{
"showname": "Source: 1c:65:9d:1f:e0:f3 (1c:65:9d:1f:e0:f3)",
"fields": [
{
"showname": "Address: 1c:65:9d:1f:e0:f3 (1c:65:9d:1f:e0:f3)"
},
{
"showname": ".... ..0. .... .... .... .... = LG bit: Globally unique address (factory default)"
},
{
"showname": ".... ...0 .... .... .... .... = IG bit: Individual address (unicast)"
}
]
},
{
"showname": "Type: IP (0x0800)"
}
]
},
{
"showname": "Internet Protocol Version 4, Src: 192.168.0.101 (192.168.0.101), Dst: 192.168.0.255 (192.168.0.255)",
"fields": [
{
"showname": "Version: 4"
},
{
"showname": "Header length: 20 bytes"
},
{
"showname": "Differentiated Services Field: 0x00 (DSCP 0x00: Default; ECN: 0x00: Not-ECT (Not ECN-Capable Transport))",
"fields": [
{
"showname": "0000 00.. = Differentiated Services Codepoint: Default (0x00)"
},
{
"showname": ".... ..00 = Explicit Congestion Notification: Not-ECT (Not ECN-Capable Transport) (0x00)"
}
]
},
{
"showname": "Total Length: 78"
},
{
"showname": "Identification: 0x6c79 (27769)"
},
{
"showname": "Flags: 0x00",
"fields": [
{
"showname": "0... .... = Reserved bit: Not set"
},
{
"showname": ".0.. .... = Don't fragment: Not set"
},
{
"showname": "..0. .... = More fragments: Not set"
}
]
},
{
"showname": "Fragment offset: 0"
},
{
"showname": "Time to live: 64"
},
{
"showname": "Protocol: UDP (17)"
},
{
"showname": "Header checksum: 0x8b71 [correct]",
"fields": [
{
"showname": "[Good: True]"
},
{
"showname": "[Bad: False]"
}
]
},
{
"showname": "Source: 192.168.0.101 (192.168.0.101)"
},
{
"showname": "Destination: 192.168.0.255 (192.168.0.255)"
}
]
},
{
"showname": "User Datagram Protocol, Src Port: netbios-ns (137), Dst Port: netbios-ns (137)",
"fields": [
{
"showname": "Source port: netbios-ns (137)"
},
{
"showname": "Destination port: netbios-ns (137)"
},
{
"showname": "Length: 58"
},
{
"showname": "Checksum: 0x5a26 [validation disabled]",
"fields": [
{
"showname": "[Good Checksum: False]"
},
{
"showname": "[Bad Checksum: False]"
}
]
}
]
},
{
"showname": "NetBIOS Name Service",
"fields": [
{
"showname": "Transaction ID: 0xe01e"
},
{
"showname": "Flags: 0x0110 (Name query)",
"fields": [
{
"showname": "0... .... .... .... = Response: Message is a query"
},
{
"showname": ".000 0... .... .... = Opcode: Name query (0)"
},
{
"showname": ".... ..0. .... .... = Truncated: Message is not truncated"
},
{
"showname": ".... ...1 .... .... = Recursion desired: Do query recursively"
},
{
"showname": ".... .... ...1 .... = Broadcast: Broadcast packet"
}
]
},
{
"showname": "Questions: 1"
},
{
"showname": "Answer RRs: 0"
},
{
"showname": "Authority RRs: 0"
},
{
"showname": "Additional RRs: 0"
},
{
"showname": "Queries",
"fields": [
{
"showname": "WPAD<00>: type NB, class IN",
"fields": [
{
"showname": "Name: WPAD<00> (Workstation/Redirector)"
},
{
"showname": "Type: NB"
},
{
"showname": "Class: IN"
}
]
}
]
}
]
}
]
}
{
"protocols": [
{
"showname": "Frame 2: 92 bytes on wire (736 bits), 92 bytes captured (736 bits) on interface 0",
"fields": [
{
"showname": "Interface id: 0"
},
{
"showname": "Encapsulation type: Ethernet (1)"
},
{
"showname": "Arrival Time: Sep 16, 2013 20:41:02.711728000 PDT"
},
{
"showname": "[Time shift for this packet: 0.000000000 seconds]"
},
{
"showname": "Epoch Time: 1379389262.711728000 seconds"
},
{
"showname": "[Time delta from previous captured frame: 0.716711000 seconds]"
},
{
"showname": "[Time delta from previous displayed frame: 0.716711000 seconds]"
},
{
"showname": "[Time since reference or first frame: 0.716711000 seconds]"
},
{
"showname": "Frame Number: 2"
},
{
"showname": "Frame Length: 92 bytes (736 bits)"
},
{
"showname": "Capture Length: 92 bytes (736 bits)"
},
{
"showname": "[Frame is marked: False]"
},
{
"showname": "[Frame is ignored: False]"
},
{
"showname": "[Protocols in frame: eth:ip:udp:nbns]"
}
]
},
{
"showname": "Ethernet II, Src: 1c:65:9d:1f:e0:f3 (1c:65:9d:1f:e0:f3), Dst: ff:ff:ff:ff:ff:ff (ff:ff:ff:ff:ff:ff)",
"fields": [
{
"showname": "Destination: ff:ff:ff:ff:ff:ff (ff:ff:ff:ff:ff:ff)",
"fields": [
{
"showname": "Address: ff:ff:ff:ff:ff:ff (ff:ff:ff:ff:ff:ff)"
},
{
"showname": ".... ..1. .... .... .... .... = LG bit: Locally administered address (this is NOT the factory default)"
},
{
"showname": ".... ...1 .... .... .... .... = IG bit: Group address (multicast/broadcast)"
}
]
},
{
"showname": "Source: 1c:65:9d:1f:e0:f3 (1c:65:9d:1f:e0:f3)",
"fields": [
{
"showname": "Address: 1c:65:9d:1f:e0:f3 (1c:65:9d:1f:e0:f3)"
},
{
"showname": ".... ..0. .... .... .... .... = LG bit: Globally unique address (factory default)"
},
{
"showname": ".... ...0 .... .... .... .... = IG bit: Individual address (unicast)"
}
]
},
{
"showname": "Type: IP (0x0800)"
}
]
},
{
"showname": "Internet Protocol Version 4, Src: 192.168.0.101 (192.168.0.101), Dst: 192.168.0.255 (192.168.0.255)",
"fields": [
{
"showname": "Version: 4"
},
{
"showname": "Header length: 20 bytes"
},
{
"showname": "Differentiated Services Field: 0x00 (DSCP 0x00: Default; ECN: 0x00: Not-ECT (Not ECN-Capable Transport))",
"fields": [
{
"showname": "0000 00.. = Differentiated Services Codepoint: Default (0x00)"
},
{
"showname": ".... ..00 = Explicit Congestion Notification: Not-ECT (Not ECN-Capable Transport) (0x00)"
}
]
},
{
"showname": "Total Length: 78"
},
{
"showname": "Identification: 0x6c7f (27775)"
},
{
"showname": "Flags: 0x00",
"fields": [
{
"showname": "0... .... = Reserved bit: Not set"
},
{
"showname": ".0.. .... = Don't fragment: Not set"
},
{
"showname": "..0. .... = More fragments: Not set"
}
]
},
{
"showname": "Fragment offset: 0"
},
{
"showname": "Time to live: 64"
},
{
"showname": "Protocol: UDP (17)"
},
{
"showname": "Header checksum: 0x8b6b [correct]",
"fields": [
{
"showname": "[Good: True]"
},
{
"showname": "[Bad: False]"
}
]
},
{
"showname": "Source: 192.168.0.101 (192.168.0.101)"
},
{
"showname": "Destination: 192.168.0.255 (192.168.0.255)"
}
]
},
{
"showname": "User Datagram Protocol, Src Port: netbios-ns (137), Dst Port: netbios-ns (137)",
"fields": [
{
"showname": "Source port: netbios-ns (137)"
},
{
"showname": "Destination port: netbios-ns (137)"
},
{
"showname": "Length: 58"
},
{
"showname": "Checksum: 0x5a26 [validation disabled]",
"fields": [
{
"showname": "[Good Checksum: False]"
},
{
"showname": "[Bad Checksum: False]"
}
]
}
]
},
{
"showname": "NetBIOS Name Service",
"fields": [
{
"showname": "Transaction ID: 0xe01e"
},
{
"showname": "Flags: 0x0110 (Name query)",
"fields": [
{
"showname": "0... .... .... .... = Response: Message is a query"
},
{
"showname": ".000 0... .... .... = Opcode: Name query (0)"
},
{
"showname": ".... ..0. .... .... = Truncated: Message is not truncated"
},
{
"showname": ".... ...1 .... .... = Recursion desired: Do query recursively"
},
{
"showname": ".... .... ...1 .... = Broadcast: Broadcast packet"
}
]
},
{
"showname": "Questions: 1"
},
{
"showname": "Answer RRs: 0"
},
{
"showname": "Authority RRs: 0"
},
{
"showname": "Additional RRs: 0"
},
{
"showname": "Queries",
"fields": [
{
"showname": "WPAD<00>: type NB, class IN",
"fields": [
{
"showname": "Name: WPAD<00> (Workstation/Redirector)"
},
{
"showname": "Type: NB"
},
{
"showname": "Class: IN"
}
]
}
]
}
]
}
]
}
{
"protocols": [
{
"showname": "Frame 3: 148 bytes on wire (1184 bits), 148 bytes captured (1184 bits) on interface 0",
"fields": [
{
"showname": "Interface id: 0"
},
{
"showname": "Encapsulation type: Ethernet (1)"
},
{
"showname": "Arrival Time: Sep 16, 2013 20:41:05.994258000 PDT"
},
{
"showname": "[Time shift for this packet: 0.000000000 seconds]"
},
{
"showname": "Epoch Time: 1379389265.994258000 seconds"
},
{
"showname": "[Time delta from previous captured frame: 3.282530000 seconds]"
},
{
"showname": "[Time delta from previous displayed frame: 3.282530000 seconds]"
},
{
"showname": "[Time since reference or first frame: 3.999241000 seconds]"
},
{
"showname": "Frame Number: 3"
},
{
"showname": "Frame Length: 148 bytes (1184 bits)"
},
{
"showname": "Capture Length: 148 bytes (1184 bits)"
},
{
"showname": "[Frame is marked: False]"
},
{
"showname": "[Frame is ignored: False]"
},
{
"showname": "[Protocols in frame: eth:ip:tcp:ssl]"
}
]
},
{
"showname": "Ethernet II, Src: 1c:7e:e5:94:c1:fc (1c:7e:e5:94:c1:fc), Dst: 00:21:6a:6e:55:d4 (00:21:6a:6e:55:d4)",
"fields": [
{
"showname": "Destination: 00:21:6a:6e:55:d4 (00:21:6a:6e:55:d4)",
"fields": [
{
"showname": "Address: 00:21:6a:6e:55:d4 (00:21:6a:6e:55:d4)"
},
{
"showname": ".... ..0. .... .... .... .... = LG bit: Globally unique address (factory default)"
},
{
"showname": ".... ...0 .... .... .... .... = IG bit: Individual address (unicast)"
}
]
},
{
"showname": "Source: 1c:7e:e5:94:c1:fc (1c:7e:e5:94:c1:fc)",
"fields": [
{
"showname": "Address: 1c:7e:e5:94:c1:fc (1c:7e:e5:94:c1:fc)"
},
{
"showname": ".... ..0. .... .... .... .... = LG bit: Globally unique address (factory default)"
},
{
"showname": ".... ...0 .... .... .... .... = IG bit: Individual address (unicast)"
}
]
},
{
"showname": "Type: IP (0x0800)"
}
]
},
{
"showname": "Internet Protocol Version 4, Src: 173.194.127.161 (173.194.127.161), Dst: 192.168.0.107 (192.168.0.107)",
"fields": [
{
"showname": "Version: 4"
},
{
"showname": "Header length: 20 bytes"
},
{
"showname": "Differentiated Services Field: 0x00 (DSCP 0x00: Default; ECN: 0x00: Not-ECT (Not ECN-Capable Transport))",
"fields": [
{
"showname": "0000 00.. = Differentiated Services Codepoint: Default (0x00)"
},
{
"showname": ".... ..00 = Explicit Congestion Notification: Not-ECT (Not ECN-Capable Transport) (0x00)"
}
]
},
{
"showname": "Total Length: 134"
},
{
"showname": "Identification: 0xae5f (44639)"
},
{
"showname": "Flags: 0x00",
"fields": [
{
"showname": "0... .... = Reserved bit: Not set"
},
{
"showname": ".0.. .... = Don't fragment: Not set"
},
{
"showname": "..0. .... = More fragments: Not set"
}
]
},
{
"showname": "Fragment offset: 0"
},
{
"showname": "Time to live: 47"
},
{
"showname": "Protocol: TCP (6)"
},
{
"showname": "Header checksum: 0xee9b [correct]",
"fields": [
{
"showname": "[Good: True]"
},
{
"showname": "[Bad: False]"
}
]
},
{
"showname": "Source: 173.194.127.161 (173.194.127.161)"
},
{
"showname": "Destination: 192.168.0.107 (192.168.0.107)"
}
]
},
{
"showname": "Transmission Control Protocol, Src Port: https (443), Dst Port: 48857 (48857), Seq: 1, Ack: 1, Len: 82",
"fields": [
{
"showname": "Source port: https (443)"
},
{
"showname": "Destination port: 48857 (48857)"
},
{
"showname": "[Stream index: 0]"
},
{
"showname": "[TCP Segment Len: 82]"
},
{
"showname": "Sequence number: 1    (relative sequence number)"
},
{
"showname": "[Next sequence number: 83    (relative sequence number)]"
},
{
"showname": "Acknowledgment number: 1    (relative ack number)"
},
{
"showname": "Header length: 32 bytes"
},
{
"showname": "Flags: 0x018 (PSH, ACK)",
"fields": [
{
"showname": "000. .... .... = Reserved: Not set"
},
{
"showname": "...0 .... .... = Nonce: Not set"
},
{
"showname": ".... 0... .... = Congestion Window Reduced (CWR): Not set"
},
{
"showname": ".... .0.. .... = ECN-Echo: Not set"
},
{
"showname": ".... ..0. .... = Urgent: Not set"
},
{
"showname": ".... ...1 .... = Acknowledgment: Set"
},
{
"showname": ".... .... 1... = Push: Set"
},
{
"showname": ".... .... .0.. = Reset: Not set"
},
{
"showname": ".... .... ..0. = Syn: Not set"
},
{
"showname": ".... .... ...0 = Fin: Not set"
}
]
},
{
"showname": "Window size value: 661"
},
{
"showname": "[Calculated window size: 661]"
},
{
"showname": "[Window size scaling factor: -1 (unknown)]"
},
{
"showname": "Checksum: 0xc167 [validation disabled]",
"fields": [
{
"showname": "[Good Checksum: False]"
},
{
"showname": "[Bad Checksum: False]"
}
]
},
{
"showname": "Urgent pointer: 0"
},
{
"showname": "Options: (12 bytes), No-Operation (NOP), No-Operation (NOP), Timestamps",
"fields": [
{
"showname": "No-Operation (NOP)",
"fields": [
{
"showname": "Type: 1",
"fields": [
{
"showname": "0... .... = Copy on fragmentation: No"
},
{
"showname": ".00. .... = Class: Control (0)"
},
{
"showname": "...0 0001 = Number: No-Operation (NOP) (1)"
}
]
}
]
},
{
"showname": "No-Operation (NOP)",
"fields": [
{
"showname": "Type: 1",
"fields": [
{
"showname": "0... .... = Copy on fragmentation: No"
},
{
"showname": ".00. .... = Class: Control (0)"
},
{
"showname": "...0 0001 = Number: No-Operation (NOP) (1)"
}
]
}
]
},
{
"showname": "Timestamps: TSval 2175136543, TSecr 25971286",
"fields": [
{
"showname": "Kind: Timestamp (8)"
},
{
"showname": "Length: 10"
},
{
"showname": "Timestamp value: 2175136543"
},
{
"showname": "Timestamp echo reply: 25971286"
}
]
}
]
},
{
"showname": "[SEQ/ACK analysis]",
"fields": [
{
"showname": "[Bytes in flight: 82]"
}
]
}
]
},
{
"showname": "Secure Sockets Layer",
"fields": [
{
"showname": "TLSv1.1 Record Layer: Application Data Protocol: http",
"fields": [
{
"showname": "Content Type: Application Data (23)"
},
{
"showname": "Version: TLS 1.1 (0x0302)"
},
{
"showname": "Length: 77"
},
{
"showname": "Encrypted Application Data: 295ce73df30fb46d8769762776d369fae820fbc7686b8ae9..."
}
]
}
]
}
]
}
