{
"protocols": [
{
"showname": "Frame 1: 134 bytes on wire (1072 bits), 134 bytes captured (1072 bits) on interface 0",
"fields": [
{
"showname": "Interface id: 0"
},
{
"showname": "Encapsulation type: Ethernet (1)"
},
{
"showname": "Arrival Time: Sep 19, 2013 17:54:09.464079000 PDT"
},
{
"showname": "[Time shift for this packet: 0.000000000 seconds]"
},
{
"showname": "Epoch Time: 1379638449.464079000 seconds"
},
{
"showname": "[Time delta from previous captured frame: 0.000000000 seconds]"
},
{
"showname": "[Time delta from previous displayed frame: 0.000000000 seconds]"
},
{
"showname": "[Time since reference or first frame: 0.000000000 seconds]"
},
{
"showname": "Frame Number: 1"
},
{
"showname": "Frame Length: 134 bytes (1072 bits)"
},
{
"showname": "Capture Length: 134 bytes (1072 bits)"
},
{
"showname": "[Frame is marked: False]"
},
{
"showname": "[Frame is ignored: False]"
},
{
"showname": "[Protocols in frame: eth:ip:tcp:ssl]"
}
]
},
{
"showname": "Ethernet II, Src: 1c:7e:e5:94:c1:fc (1c:7e:e5:94:c1:fc), Dst: 00:21:6a:6e:55:d4 (00:21:6a:6e:55:d4)",
"fields": [
{
"showname": "Destination: 00:21:6a:6e:55:d4 (00:21:6a:6e:55:d4)",
"fields": [
{
"showname": "Address: 00:21:6a:6e:55:d4 (00:21:6a:6e:55:d4)"
},
{
"showname": ".... ..0. .... .... .... .... = LG bit: Globally unique address (factory default)"
},
{
"showname": ".... ...0 .... .... .... .... = IG bit: Individual address (unicast)"
}
]
},
{
"showname": "Source: 1c:7e:e5:94:c1:fc (1c:7e:e5:94:c1:fc)",
"fields": [
{
"showname": "Address: 1c:7e:e5:94:c1:fc (1c:7e:e5:94:c1:fc)"
},
{
"showname": ".... ..0. .... .... .... .... = LG bit: Globally unique address (factory default)"
},
{
"showname": ".... ...0 .... .... .... .... = IG bit: Individual address (unicast)"
}
]
},
{
"showname": "Type: IP (0x0800)"
}
]
},
{
"showname": "Internet Protocol Version 4, Src: 74.125.128.102 (74.125.128.102), Dst: 192.168.0.107 (192.168.0.107)",
"fields": [
{
"showname": "Version: 4"
},
{
"showname": "Header length: 20 bytes"
},
{
"showname": "Differentiated Services Field: 0x00 (DSCP 0x00: Default; ECN: 0x00: Not-ECT (Not ECN-Capable Transport))",
"fields": [
{
"showname": "0000 00.. = Differentiated Services Codepoint: Default (0x00)"
},
{
"showname": ".... ..00 = Explicit Congestion Notification: Not-ECT (Not ECN-Capable Transport) (0x00)"
}
]
},
{
"showname": "Total Length: 120"
},
{
"showname": "Identification: 0x94ed (38125)"
},
{
"showname": "Flags: 0x00",
"fields": [
{
"showname": "0... .... = Reserved bit: Not set"
},
{
"showname": ".0.. .... = Don't fragment: Not set"
},
{
"showname": "..0. .... = More fragments: Not set"
}
]
},
{
"showname": "Fragment offset: 0"
},
{
"showname": "Time to live: 41"
},
{
"showname": "Protocol: TCP (6)"
},
{
"showname": "Header checksum: 0x709c [correct]",
"fields": [
{
"showname": "[Good: True]"
},
{
"showname": "[Bad: False]"
}
]
},
{
"showname": "Source: 74.125.128.102 (74.125.128.102)"
},
{
"showname": "Destination: 192.168.0.107 (192.168.0.107)"
}
]
},
{
"showname": "Transmission Control Protocol, Src Port: https (443), Dst Port: 39752 (39752), Seq: 1, Ack: 1, Len: 80",
"fields": [
{
"showname": "Source port: https (443)"
},
{
"showname": "Destination port: 39752 (39752)"
},
{
"showname": "[Stream index: 0]"
},
{
"showname": "[TCP Segment Len: 80]"
},
{
"showname": "Sequence number: 1    (relative sequence number)"
},
{
"showname": "[Next sequence number: 81    (relative sequence number)]"
},
{
"showname": "Acknowledgment number: 1    (relative ack number)"
},
{
"showname": "Header length: 20 bytes"
},
{
"showname": "Flags: 0x018 (PSH, ACK)",
"fields": [
{
"showname": "000. .... .... = Reserved: Not set"
},
{
"showname": "...0 .... .... = Nonce: Not set"
},
{
"showname": ".... 0... .... = Congestion Window Reduced (CWR): Not set"
},
{
"showname": ".... .0.. .... = ECN-Echo: Not set"
},
{
"showname": ".... ..0. .... = Urgent: Not set"
},
{
"showname": ".... ...1 .... = Acknowledgment: Set"
},
{
"showname": ".... .... 1... = Push: Set"
},
{
"showname": ".... .... .0.. = Reset: Not set"
},
{
"showname": ".... .... ..0. = Syn: Not set"
},
{
"showname": ".... .... ...0 = Fin: Not set"
}
]
},
{
"showname": "Window size value: 1341"
},
{
"showname": "[Calculated window size: 1341]"
},
{
"showname": "[Window size scaling factor: -1 (unknown)]"
},
{
"showname": "Checksum: 0x6e68 [validation disabled]",
"fields": [
{
"showname": "[Good Checksum: False]"
},
{
"showname": "[Bad Checksum: False]"
}
]
},
{
"showname": "Urgent pointer: 0"
},
{
"showname": "[SEQ/ACK analysis]",
"fields": [
{
"showname": "[Bytes in flight: 80]"
}
]
}
]
},
{
"showname": "Secure Sockets Layer",
"fields": [
{
"showname": "TLSv1.1 Record Layer: Application Data Protocol: http",
"fields": [
{
"showname": "Content Type: Application Data (23)"
},
{
"showname": "Version: TLS 1.1 (0x0302)"
},
{
"showname": "Length: 75"
},
{
"showname": "Encrypted Application Data: 8c376af89e8d1e67b5a30559dc9f050e7f017193d0cea2b3..."
}
]
}
]
}
]
}
{
"protocols": [
{
"showname": "Frame 2: 54 bytes on wire (432 bits), 54 bytes captured (432 bits) on interface 0",
"fields": [
{
"showname": "Interface id: 0"
},
{
"showname": "Encapsulation type: Ethernet (1)"
},
{
"showname": "Arrival Time: Sep 19, 2013 17:54:09.464129000 PDT"
},
{
"showname": "[Time shift for this packet: 0.000000000 seconds]"
},
{
"showname": "Epoch Time: 1379638449.464129000 seconds"
},
{
"showname": "[Time delta from previous captured frame: 0.000050000 seconds]"
},
{
"showname": "[Time delta from previous displayed frame: 0.000050000 seconds]"
},
{
"showname": "[Time since reference or first frame: 0.000050000 seconds]"
},
{
"showname": "Frame Number: 2"
},
{
"showname": "Frame Length: 54 bytes (432 bits)"
},
{
"showname": "Capture Length: 54 bytes (432 bits)"
},
{
"showname": "[Frame is marked: False]"
},
{
"showname": "[Frame is ignored: False]"
},
{
"showname": "[Protocols in frame: eth:ip:tcp]"
}
]
},
{
"showname": "Ethernet II, Src: 00:21:6a:6e:55:d4 (00:21:6a:6e:55:d4), Dst: 1c:7e:e5:94:c1:fc (1c:7e:e5:94:c1:fc)",
"fields": [
{
"showname": "Destination: 1c:7e:e5:94:c1:fc (1c:7e:e5:94:c1:fc)",
"fields": [
{
"showname": "Address: 1c:7e:e5:94:c1:fc (1c:7e:e5:94:c1:fc)"
},
{
"showname": ".... ..0. .... .... .... .... = LG bit: Globally unique address (factory default)"
},
{
"showname": ".... ...0 .... .... .... .... = IG bit: Individual address (unicast)"
}
]
},
{
"showname": "Source: 00:21:6a:6e:55:d4 (00:21:6a:6e:55:d4)",
"fields": [
{
"showname": "Address: 00:21:6a:6e:55:d4 (00:21:6a:6e:55:d4)"
},
{
"showname": ".... ..0. .... .... .... .... = LG bit: Globally unique address (factory default)"
},
{
"showname": ".... ...0 .... .... .... .... = IG bit: Individual address (unicast)"
}
]
},
{
"showname": "Type: IP (0x0800)"
}
]
},
{
"showname": "Internet Protocol Version 4, Src: 192.168.0.107 (192.168.0.107), Dst: 74.125.128.102 (74.125.128.102)",
"fields": [
{
"showname": "Version: 4"
},
{
"showname": "Header length: 20 bytes"
},
{
"showname": "Differentiated Services Field: 0x00 (DSCP 0x00: Default; ECN: 0x00: Not-ECT (Not ECN-Capable Transport))",
"fields": [
{
"showname": "0000 00.. = Differentiated Services Codepoint: Default (0x00)"
},
{
"showname": ".... ..00 = Explicit Congestion Notification: Not-ECT (Not ECN-Capable Transport) (0x00)"
}
]
},
{
"showname": "Total Length: 40"
},
{
"showname": "Identification: 0x45ce (17870)"
},
{
"showname": "Flags: 0x02 (Don't Fragment)",
"fields": [
{
"showname": "0... .... = Reserved bit: Not set"
},
{
"showname": ".1.. .... = Don't fragment: Set"
},
{
"showname": "..0. .... = More fragments: Not set"
}
]
},
{
"showname": "Fragment offset: 0"
},
{
"showname": "Time to live: 64"
},
{
"showname": "Protocol: TCP (6)"
},
{
"showname": "Header checksum: 0x690b [correct]",
"fields": [
{
"showname": "[Good: True]"
},
{
"showname": "[Bad: False]"
}
]
},
{
"showname": "Source: 192.168.0.107 (192.168.0.107)"
},
{
"showname": "Destination: 74.125.128.102 (74.125.128.102)"
}
]
},
{
"showname": "Transmission Control Protocol, Src Port: 39752 (39752), Dst Port: https (443), Seq: 1, Ack: 81, Len: 0",
"fields": [
{
"showname": "Source port: 39752 (39752)"
},
{
"showname": "Destination port: https (443)"
},
{
"showname": "[Stream index: 0]"
},
{
"showname": "[TCP Segment Len: 0]"
},
{
"showname": "Sequence number: 1    (relative sequence number)"
},
{
"showname": "Acknowledgment number: 81    (relative ack number)"
},
{
"showname": "Header length: 20 bytes"
},
{
"showname": "Flags: 0x010 (ACK)",
"fields": [
{
"showname": "000. .... .... = Reserved: Not set"
},
{
"showname": "...0 .... .... = Nonce: Not set"
},
{
"showname": ".... 0... .... = Congestion Window Reduced (CWR): Not set"
},
{
"showname": ".... .0.. .... = ECN-Echo: Not set"
},
{
"showname": ".... ..0. .... = Urgent: Not set"
},
{
"showname": ".... ...1 .... = Acknowledgment: Set"
},
{
"showname": ".... .... 0... = Push: Not set"
},
{
"showname": ".... .... .0.. = Reset: Not set"
},
{
"showname": ".... .... ..0. = Syn: Not set"
},
{
"showname": ".... .... ...0 = Fin: Not set"
}
]
},
{
"showname": "Window size value: 1146"
},
{
"showname": "[Calculated window size: 1146]"
},
{
"showname": "[Window size scaling factor: -1 (unknown)]"
},
{
"showname": "Checksum: 0x8c11 [validation disabled]",
"fields": [
{
"showname": "[Good Checksum: False]"
},
{
"showname": "[Bad Checksum: False]"
}
]
},
{
"showname": "Urgent pointer: 0"
},
{
"showname": "[SEQ/ACK analysis]",
"fields": [
{
"showname": "[This is an ACK to the segment in frame: 1]"
},
{
"showname": "[The RTT to ACK the segment was: 0.000050000 seconds]"
}
]
}
]
}
]
}
{
"protocols": [
{
"showname": "Frame 3: 134 bytes on wire (1072 bits), 134 bytes captured (1072 bits) on interface 0",
"fields": [
{
"showname": "Interface id: 0"
},
{
"showname": "Encapsulation type: Ethernet (1)"
},
{
"showname": "Arrival Time: Sep 19, 2013 17:54:09.768293000 PDT"
},
{
"showname": "[Time shift for this packet: 0.000000000 seconds]"
},
{
"showname": "Epoch Time: 1379638449.768293000 seconds"
},
{
"showname": "[Time delta from previous captured frame: 0.304164000 seconds]"
},
{
"showname": "[Time delta from previous displayed frame: 0.304164000 seconds]"
},
{
"showname": "[Time since reference or first frame: 0.304214000 seconds]"
},
{
"showname": "Frame Number: 3"
},
{
"showname": "Frame Length: 134 bytes (1072 bits)"
},
{
"showname": "Capture Length: 134 bytes (1072 bits)"
},
{
"showname": "[Frame is marked: False]"
},
{
"showname": "[Frame is ignored: False]"
},
{
"showname": "[Protocols in frame: eth:ip:tcp:ssl]"
}
]
},
{
"showname": "Ethernet II, Src: 1c:7e:e5:94:c1:fc (1c:7e:e5:94:c1:fc), Dst: 00:21:6a:6e:55:d4 (00:21:6a:6e:55:d4)",
"fields": [
{
"showname": "Destination: 00:21:6a:6e:55:d4 (00:21:6a:6e:55:d4)",
"fields": [
{
"showname": "Address: 00:21:6a:6e:55:d4 (00:21:6a:6e:55:d4)"
},
{
"showname": ".... ..0. .... .... .... .... = LG bit: Globally unique address (factory default)"
},
{
"showname": ".... ...0 .... .... .... .... = IG bit: Individual address (unicast)"
}
]
},
{
"showname": "Source: 1c:7e:e5:94:c1:fc (1c:7e:e5:94:c1:fc)",
"fields": [
{
"showname": "Address: 1c:7e:e5:94:c1:fc (1c:7e:e5:94:c1:fc)"
},
{
"showname": ".... ..0. .... .... .... .... = LG bit: Globally unique address (factory default)"
},
{
"showname": ".... ...0 .... .... .... .... = IG bit: Individual address (unicast)"
}
]
},
{
"showname": "Type: IP (0x0800)"
}
]
},
{
"showname": "Internet Protocol Version 4, Src: 74.125.128.102 (74.125.128.102), Dst: 192.168.0.107 (192.168.0.107)",
"fields": [
{
"showname": "Version: 4"
},
{
"showname": "Header length: 20 bytes"
},
{
"showname": "Differentiated Services Field: 0x00 (DSCP 0x00: Default; ECN: 0x00: Not-ECT (Not ECN-Capable Transport))",
"fields": [
{
"showname": "0000 00.. = Differentiated Services Codepoint: Default (0x00)"
},
{
"showname": ".... ..00 = Explicit Congestion Notification: Not-ECT (Not ECN-Capable Transport) (0x00)"
}
]
},
{
"showname": "Total Length: 120"
},
{
"showname": "Identification: 0x94ee (38126)"
},
{
"showname": "Flags: 0x00",
"fields": [
{
"showname": "0... .... = Reserved bit: Not set"
},
{
"showname": ".0.. .... = Don't fragment: Not set"
},
{
"showname": "..0. .... = More fragments: Not set"
}
]
},
{
"showname": "Fragment offset: 0"
},
{
"showname": "Time to live: 41"
},
{
"showname": "Protocol: TCP (6)"
},
{
"showname": "Header checksum: 0x709b [correct]",
"fields": [
{
"showname": "[Good: True]"
},
{
"showname": "[Bad: False]"
}
]
},
{
"showname": "Source: 74.125.128.102 (74.125.128.102)"
},
{
"showname": "Destination: 192.168.0.107 (192.168.0.107)"
}
]
},
{
"showname": "Transmission Control Protocol, Src Port: https (443), Dst Port: 39752 (39752), Seq: 81, Ack: 1, Len: 80",
"fields": [
{
"showname": "Source port: https (443)"
},
{
"showname": "Destination port: 39752 (39752)"
},
{
"showname": "[Stream index: 0]"
},
{
"showname": "[TCP Segment Len: 80]"
},
{
"showname": "Sequence number: 81    (relative sequence number)"
},
{
"showname": "[Next sequence number: 161    (relative sequence number)]"
},
{
"showname": "Acknowledgment number: 1    (relative ack number)"
},
{
"showname": "Header length: 20 bytes"
},
{
"showname": "Flags: 0x018 (PSH, ACK)",
"fields": [
{
"showname": "000. .... .... = Reserved: Not set"
},
{
"showname": "...0 .... .... = Nonce: Not set"
},
{
"showname": ".... 0... .... = Congestion Window Reduced (CWR): Not set"
},
{
"showname": ".... .0.. .... = ECN-Echo: Not set"
},
{
"showname": ".... ..0. .... = Urgent: Not set"
},
{
"showname": ".... ...1 .... = Acknowledgment: Set"
},
{
"showname": ".... .... 1... = Push: Set"
},
{
"showname": ".... .... .0.. = Reset: Not set"
},
{
"showname": ".... .... ..0. = Syn: Not set"
},
{
"showname": ".... .... ...0 = Fin: Not set"
}
]
},
{
"showname": "Window size value: 1341"
},
{
"showname": "[Calculated window size: 1341]"
},
{
"showname": "[Window size scaling factor: -1 (unknown)]"
},
{
"showname": "Checksum: 0xe5e8 [validation disabled]",
"fields": [
{
"showname": "[Good Checksum: False]"
},
{
"showname": "[Bad Checksum: False]"
}
]
},
{
"showname": "Urgent pointer: 0"
},
{
"showname": "[SEQ/ACK analysis]",
"fields": [
{
"showname": "[Bytes in flight: 80]"
}
]
}
]
},
{
"showname": "Secure Sockets Layer",
"fields": [
{
"showname": "TLSv1.1 Record Layer: Application Data Protocol: http",
"fields": [
{
"showname": "Content Type: Application Data (23)"
},
{
"showname": "Version: TLS 1.1 (0x0302)"
},
{
"showname": "Length: 75"
},
{
"showname": "Encrypted Application Data: 4957d1ca7917dccc40299f57421026c3a620b2914eab6e0a..."
}
]
}
]
}
]
}
{
"protocols": [
{
"showname": "Frame 4: 54 bytes on wire (432 bits), 54 bytes captured (432 bits) on interface 0",
"fields": [
{
"showname": "Interface id: 0"
},
{
"showname": "Encapsulation type: Ethernet (1)"
},
{
"showname": "Arrival Time: Sep 19, 2013 17:54:09.768347000 PDT"
},
{
"showname": "[Time shift for this packet: 0.000000000 seconds]"
},
{
"showname": "Epoch Time: 1379638449.768347000 seconds"
},
{
"showname": "[Time delta from previous captured frame: 0.000054000 seconds]"
},
{
"showname": "[Time delta from previous displayed frame: 0.000054000 seconds]"
},
{
"showname": "[Time since reference or first frame: 0.304268000 seconds]"
},
{
"showname": "Frame Number: 4"
},
{
"showname": "Frame Length: 54 bytes (432 bits)"
},
{
"showname": "Capture Length: 54 bytes (432 bits)"
},
{
"showname": "[Frame is marked: False]"
},
{
"showname": "[Frame is ignored: False]"
},
{
"showname": "[Protocols in frame: eth:ip:tcp]"
}
]
},
{
"showname": "Ethernet II, Src: 00:21:6a:6e:55:d4 (00:21:6a:6e:55:d4), Dst: 1c:7e:e5:94:c1:fc (1c:7e:e5:94:c1:fc)",
"fields": [
{
"showname": "Destination: 1c:7e:e5:94:c1:fc (1c:7e:e5:94:c1:fc)",
"fields": [
{
"showname": "Address: 1c:7e:e5:94:c1:fc (1c:7e:e5:94:c1:fc)"
},
{
"showname": ".... ..0. .... .... .... .... = LG bit: Globally unique address (factory default)"
},
{
"showname": ".... ...0 .... .... .... .... = IG bit: Individual address (unicast)"
}
]
},
{
"showname": "Source: 00:21:6a:6e:55:d4 (00:21:6a:6e:55:d4)",
"fields": [
{
"showname": "Address: 00:21:6a:6e:55:d4 (00:21:6a:6e:55:d4)"
},
{
"showname": ".... ..0. .... .... .... .... = LG bit: Globally unique address (factory default)"
},
{
"showname": ".... ...0 .... .... .... .... = IG bit: Individual address (unicast)"
}
]
},
{
"showname": "Type: IP (0x0800)"
}
]
},
{
"showname": "Internet Protocol Version 4, Src: 192.168.0.107 (192.168.0.107), Dst: 74.125.128.102 (74.125.128.102)",
"fields": [
{
"showname": "Version: 4"
},
{
"showname": "Header length: 20 bytes"
},
{
"showname": "Differentiated Services Field: 0x00 (DSCP 0x00: Default; ECN: 0x00: Not-ECT (Not ECN-Capable Transport))",
"fields": [
{
"showname": "0000 00.. = Differentiated Services Codepoint: Default (0x00)"
},
{
"showname": ".... ..00 = Explicit Congestion Notification: Not-ECT (Not ECN-Capable Transport) (0x00)"
}
]
},
{
"showname": "Total Length: 40"
},
{
"showname": "Identification: 0x45cf (17871)"
},
{
"showname": "Flags: 0x02 (Don't Fragment)",
"fields": [
{
"showname": "0... .... = Reserved bit: Not set"
},
{
"showname": ".1.. .... = Don't fragment: Set"
},
{
"showname": "..0. .... = More fragments: Not set"
}
]
},
{
"showname": "Fragment offset: 0"
},
{
"showname": "Time to live: 64"
},
{
"showname": "Protocol: TCP (6)"
},
{
"showname": "Header checksum: 0x690a [correct]",
"fields": [
{
"showname": "[Good: True]"
},
{
"showname": "[Bad: False]"
}
]
},
{
"showname": "Source: 192.168.0.107 (192.168.0.107)"
},
{
"showname": "Destination: 74.125.128.102 (74.125.128.102)"
}
]
},
{
"showname": "Transmission Control Protocol, Src Port: 39752 (39752), Dst Port: https (443), Seq: 1, Ack: 161, Len: 0",
"fields": [
{
"showname": "Source port: 39752 (39752)"
},
{
"showname": "Destination port: https (443)"
},
{
"showname": "[Stream index: 0]"
},
{
"showname": "[TCP Segment Len: 0]"
},
{
"showname": "Sequence number: 1    (relative sequence number)"
},
{
"showname": "Acknowledgment number: 161    (relative ack number)"
},
{
"showname": "Header length: 20 bytes"
},
{
"showname": "Flags: 0x010 (ACK)",
"fields": [
{
"showname": "000. .... .... = Reserved: Not set"
},
{
"showname": "...0 .... .... = Nonce: Not set"
},
{
"showname": ".... 0... .... = Congestion Window Reduced (CWR): Not set"
},
{
"showname": ".... .0.. .... = ECN-Echo: Not set"
},
{
"showname": ".... ..0. .... = Urgent: Not set"
},
{
"showname": ".... ...1 .... = Acknowledgment: Set"
},
{
"showname": ".... .... 0... = Push: Not set"
},
{
"showname": ".... .... .0.. = Reset: Not set"
},
{
"showname": ".... .... ..0. = Syn: Not set"
},
{
"showname": ".... .... ...0 = Fin: Not set"
}
]
},
{
"showname": "Window size value: 1146"
},
{
"showname": "[Calculated window size: 1146]"
},
{
"showname": "[Window size scaling factor: -1 (unknown)]"
},
{
"showname": "Checksum: 0x8c11 [validation disabled]",
"fields": [
{
"showname": "[Good Checksum: False]"
},
{
"showname": "[Bad Checksum: False]"
}
]
},
{
"showname": "Urgent pointer: 0"
},
{
"showname": "[SEQ/ACK analysis]",
"fields": [
{
"showname": "[This is an ACK to the segment in frame: 3]"
},
{
"showname": "[The RTT to ACK the segment was: 0.000054000 seconds]"
}
]
}
]
}
]
}
{
"protocols": [
{
"showname": "Frame 5: 87 bytes on wire (696 bits), 87 bytes captured (696 bits) on interface 0",
"fields": [
{
"showname": "Interface id: 0"
},
{
"showname": "Encapsulation type: Ethernet (1)"
},
{
"showname": "Arrival Time: Sep 19, 2013 17:54:09.768397000 PDT"
},
{
"showname": "[Time shift for this packet: 0.000000000 seconds]"
},
{
"showname": "Epoch Time: 1379638449.768397000 seconds"
},
{
"showname": "[Time delta from previous captured frame: 0.000050000 seconds]"
},
{
"showname": "[Time delta from previous displayed frame: 0.000050000 seconds]"
},
{
"showname": "[Time since reference or first frame: 0.304318000 seconds]"
},
{
"showname": "Frame Number: 5"
},
{
"showname": "Frame Length: 87 bytes (696 bits)"
},
{
"showname": "Capture Length: 87 bytes (696 bits)"
},
{
"showname": "[Frame is marked: False]"
},
{
"showname": "[Frame is ignored: False]"
},
{
"showname": "[Protocols in frame: eth:ip:tcp:ssl]"
}
]
},
{
"showname": "Ethernet II, Src: 1c:7e:e5:94:c1:fc (1c:7e:e5:94:c1:fc), Dst: 00:21:6a:6e:55:d4 (00:21:6a:6e:55:d4)",
"fields": [
{
"showname": "Destination: 00:21:6a:6e:55:d4 (00:21:6a:6e:55:d4)",
"fields": [
{
"showname": "Address: 00:21:6a:6e:55:d4 (00:21:6a:6e:55:d4)"
},
{
"showname": ".... ..0. .... .... .... .... = LG bit: Globally unique address (factory default)"
},
{
"showname": ".... ...0 .... .... .... .... = IG bit: Individual address (unicast)"
}
]
},
{
"showname": "Source: 1c:7e:e5:94:c1:fc (1c:7e:e5:94:c1:fc)",
"fields": [
{
"showname": "Address: 1c:7e:e5:94:c1:fc (1c:7e:e5:94:c1:fc)"
},
{
"showname": ".... ..0. .... .... .... .... = LG bit: Globally unique address (factory default)"
},
{
"showname": ".... ...0 .... .... .... .... = IG bit: Individual address (unicast)"
}
]
},
{
"showname": "Type: IP (0x0800)"
}
]
},
{
"showname": "Internet Protocol Version 4, Src: 74.125.128.102 (74.125.128.102), Dst: 192.168.0.107 (192.168.0.107)",
"fields": [
{
"showname": "Version: 4"
},
{
"showname": "Header length: 20 bytes"
},
{
"showname": "Differentiated Services Field: 0x00 (DSCP 0x00: Default; ECN: 0x00: Not-ECT (Not ECN-Capable Transport))",
"fields": [
{
"showname": "0000 00.. = Differentiated Services Codepoint: Default (0x00)"
},
{
"showname": ".... ..00 = Explicit Congestion Notification: Not-ECT (Not ECN-Capable Transport) (0x00)"
}
]
},
{
"showname": "Total Length: 73"
},
{
"showname": "Identification: 0x94ef (38127)"
},
{
"showname": "Flags: 0x00",
"fields": [
{
"showname": "0... .... = Reserved bit: Not set"
},
{
"showname": ".0.. .... = Don't fragment: Not set"
},
{
"showname": "..0. .... = More fragments: Not set"
}
]
},
{
"showname": "Fragment offset: 0"
},
{
"showname": "Time to live: 41"
},
{
"showname": "Protocol: TCP (6)"
},
{
"showname": "Header checksum: 0x70c9 [correct]",
"fields": [
{
"showname": "[Good: True]"
},
{
"showname": "[Bad: False]"
}
]
},
{
"showname": "Source: 74.125.128.102 (74.125.128.102)"
},
{
"showname": "Destination: 192.168.0.107 (192.168.0.107)"
}
]
},
{
"showname": "Transmission Control Protocol, Src Port: https (443), Dst Port: 39752 (39752), Seq: 161, Ack: 1, Len: 33",
"fields": [
{
"showname": "Source port: https (443)"
},
{
"showname": "Destination port: 39752 (39752)"
},
{
"showname": "[Stream index: 0]"
},
{
"showname": "[TCP Segment Len: 33]"
},
{
"showname": "Sequence number: 161    (relative sequence number)"
},
{
"showname": "[Next sequence number: 194    (relative sequence number)]"
},
{
"showname": "Acknowledgment number: 1    (relative ack number)"
},
{
"showname": "Header length: 20 bytes"
},
{
"showname": "Flags: 0x018 (PSH, ACK)",
"fields": [
{
"showname": "000. .... .... = Reserved: Not set"
},
{
"showname": "...0 .... .... = Nonce: Not set"
},
{
"showname": ".... 0... .... = Congestion Window Reduced (CWR): Not set"
},
{
"showname": ".... .0.. .... = ECN-Echo: Not set"
},
{
"showname": ".... ..0. .... = Urgent: Not set"
},
{
"showname": ".... ...1 .... = Acknowledgment: Set"
},
{
"showname": ".... .... 1... = Push: Set"
},
{
"showname": ".... .... .0.. = Reset: Not set"
},
{
"showname": ".... .... ..0. = Syn: Not set"
},
{
"showname": ".... .... ...0 = Fin: Not set"
}
]
},
{
"showname": "Window size value: 1341"
},
{
"showname": "[Calculated window size: 1341]"
},
{
"showname": "[Window size scaling factor: -1 (unknown)]"
},
{
"showname": "Checksum: 0x384e [validation disabled]",
"fields": [
{
"showname": "[Good Checksum: False]"
},
{
"showname": "[Bad Checksum: False]"
}
]
},
{
"showname": "Urgent pointer: 0"
},
{
"showname": "[SEQ/ACK analysis]",
"fields": [
{
"showname": "[Bytes in flight: 33]"
}
]
}
]
},
{
"showname": "Secure Sockets Layer",
"fields": [
{
"showname": "TLSv1.1 Record Layer: Application Data Protocol: http",
"fields": [
{
"showname": "Content Type: Application Data (23)"
},
{
"showname": "Version: TLS 1.1 (0x0302)"
},
{
"showname": "Length: 28"
},
{
"showname": "Encrypted Application Data: 76eeb4002c14ebe885521a9ca71400da4eb967dff8035d7e..."
}
]
}
]
}
]
}
{
"protocols": [
{
"showname": "Frame 6: 54 bytes on wire (432 bits), 54 bytes captured (432 bits) on interface 0",
"fields": [
{
"showname": "Interface id: 0"
},
{
"showname": "Encapsulation type: Ethernet (1)"
},
{
"showname": "Arrival Time: Sep 19, 2013 17:54:09.768412000 PDT"
},
{
"showname": "[Time shift for this packet: 0.000000000 seconds]"
},
{
"showname": "Epoch Time: 1379638449.768412000 seconds"
},
{
"showname": "[Time delta from previous captured frame: 0.000015000 seconds]"
},
{
"showname": "[Time delta from previous displayed frame: 0.000015000 seconds]"
},
{
"showname": "[Time since reference or first frame: 0.304333000 seconds]"
},
{
"showname": "Frame Number: 6"
},
{
"showname": "Frame Length: 54 bytes (432 bits)"
},
{
"showname": "Capture Length: 54 bytes (432 bits)"
},
{
"showname": "[Frame is marked: False]"
},
{
"showname": "[Frame is ignored: False]"
},
{
"showname": "[Protocols in frame: eth:ip:tcp]"
}
]
},
{
"showname": "Ethernet II, Src: 00:21:6a:6e:55:d4 (00:21:6a:6e:55:d4), Dst: 1c:7e:e5:94:c1:fc (1c:7e:e5:94:c1:fc)",
"fields": [
{
"showname": "Destination: 1c:7e:e5:94:c1:fc (1c:7e:e5:94:c1:fc)",
"fields": [
{
"showname": "Address: 1c:7e:e5:94:c1:fc (1c:7e:e5:94:c1:fc)"
},
{
"showname": ".... ..0. .... .... .... .... = LG bit: Globally unique address (factory default)"
},
{
"showname": ".... ...0 .... .... .... .... = IG bit: Individual address (unicast)"
}
]
},
{
"showname": "Source: 00:21:6a:6e:55:d4 (00:21:6a:6e:55:d4)",
"fields": [
{
"showname": "Address: 00:21:6a:6e:55:d4 (00:21:6a:6e:55:d4)"
},
{
"showname": ".... ..0. .... .... .... .... = LG bit: Globally unique address (factory default)"
},
{
"showname": ".... ...0 .... .... .... .... = IG bit: Individual address (unicast)"
}
]
},
{
"showname": "Type: IP (0x0800)"
}
]
},
{
"showname": "Internet Protocol Version 4, Src: 192.168.0.107 (192.168.0.107), Dst: 74.125.128.102 (74.125.128.102)",
"fields": [
{
"showname": "Version: 4"
},
{
"showname": "Header length: 20 bytes"
},
{
"showname": "Differentiated Services Field: 0x00 (DSCP 0x00: Default; ECN: 0x00: Not-ECT (Not ECN-Capable Transport))",
"fields": [
{
"showname": "0000 00.. = Differentiated Services Codepoint: Default (0x00)"
},
{
"showname": ".... ..00 = Explicit Congestion Notification: Not-ECT (Not ECN-Capable Transport) (0x00)"
}
]
},
{
"showname": "Total Length: 40"
},
{
"showname": "Identification: 0x45d0 (17872)"
},
{
"showname": "Flags: 0x02 (Don't Fragment)",
"fields": [
{
"showname": "0... .... = Reserved bit: Not set"
},
{
"showname": ".1.. .... = Don't fragment: Set"
},
{
"showname": "..0. .... = More fragments: Not set"
}
]
},
{
"showname": "Fragment offset: 0"
},
{
"showname": "Time to live: 64"
},
{
"showname": "Protocol: TCP (6)"
},
{
"showname": "Header checksum: 0x6909 [correct]",
"fields": [
{
"showname": "[Good: True]"
},
{
"showname": "[Bad: False]"
}
]
},
{
"showname": "Source: 192.168.0.107 (192.168.0.107)"
},
{
"showname": "Destination: 74.125.128.102 (74.125.128.102)"
}
]
},
{
"showname": "Transmission Control Protocol, Src Port: 39752 (39752), Dst Port: https (443), Seq: 1, Ack: 194, Len: 0",
"fields": [
{
"showname": "Source port: 39752 (39752)"
},
{
"showname": "Destination port: https (443)"
},
{
"showname": "[Stream index: 0]"
},
{
"showname": "[TCP Segment Len: 0]"
},
{
"showname": "Sequence number: 1    (relative sequence number)"
},
{
"showname": "Acknowledgment number: 194    (relative ack number)"
},
{
"showname": "Header length: 20 bytes"
},
{
"showname": "Flags: 0x010 (ACK)",
"fields": [
{
"showname": "000. .... .... = Reserved: Not set"
},
{
"showname": "...0 .... .... = Nonce: Not set"
},
{
"showname": ".... 0... ...6 . = Congestion Window Reduced (CWR): Not set"
},
{
"showname": ".... .0.. .... = ECN-Echo: Not set"
},
{
"showname": ".... ..0. .... = Urgent: Not set"
},
{
"showname": ".... ...1 .... = Acknowledgment: Set"
},
{
"showname": ".... .... 0... = Push: Not set"
},
{
"showname": ".... .... .0.. = Reset: Not set"
},
{
"showname": ".... .... ..0. = Syn: Not set"
},
{
"showname": ".... .... ...0 = Fin: Not set"
}
]
},
{
"showname": "Window size value: 1146"
},
{
"showname": "[Calculated window size: 1146]"
},
{
"showname": "[Window size scaling factor: -1 (unknown)]"
},
{
"showname": "Checksum: 0x8c11 [validation disabled]",
"fields": [
{
"showname": "[Good Checksum: False]"
},
{
"showname": "[Bad Checksum: False]"
}
]
},
{
"showname": "Urgent pointer: 0"
},
{
"showname": "[SEQ/ACK analysis]",
"fields": [
{
"showname": "[This is an ACK to the segment in frame: 5]"
},
{
"showname": "[The RTT to ACK the segment was: 0.000015000 seconds]"
}
]
}
]
}
]
}
{
"protocols": [
{
"showname": "Frame 7: 1484 bytes on wire (11872 bits), 1484 bytes captured (11872 bits) on interface 0",
"fields": [
{
"showname": "Interface id: 0"
},
{
"showname": "Encapsulation type: Ethernet (1)"
},
{
"showname": "Arrival Time: Sep 19, 2013 17:54:10.024078000 PDT"
},
{
"showname": "[Time shift for this packet: 0.000000000 seconds]"
},
{
"showname": "Epoch Time: 1379638450.024078000 seconds"
},
{
"showname": "[Time delta from previous captured frame: 0.255666000 seconds]"
},
{
"showname": "[Time delta from previous displayed frame: 0.255666000 seconds]"
},
{
"showname": "[Time since reference or first frame: 0.559999000 seconds]"
},
{
"showname": "Frame Number: 7"
},
{
"showname": "Frame Length: 1484 bytes (11872 bits)"
},
{
"showname": "Capture Length: 1484 bytes (11872 bits)"
},
{
"showname": "[Frame is marked: False]"
},
{
"showname": "[Frame is ignored: False]"
},
{
"showname": "[Protocols in frame: eth:ip:tcp:ssl]"
}
]
},
{
"showname": "Ethernet II, Src: 00:21:6a:6e:55:d4 (00:21:6a:6e:55:d4), Dst: 1c:7e:e5:94:c1:fc (1c:7e:e5:94:c1:fc)",
"fields": [
{
"showname": "Destination: 1c:7e:e5:94:c1:fc (1c:7e:e5:94:c1:fc)",
"fields": [
{
"showname": "Address: 1c:7e:e5:94:c1:fc (1c:7e:e5:94:c1:fc)"
},
{
"showname": ".... ..0. .... .... .... .... = LG bit: Globally unique address (factory default)"
},
{
"showname": ".... ...0 .... .... .... .... = IG bit: Individual address (unicast)"
}
]
},
{
"showname": "Source: 00:21:6a:6e:55:d4 (00:21:6a:6e:55:d4)",
"fields": [
{
"showname": "Address: 00:21:6a:6e:55:d4 (00:21:6a:6e:55:d4)"
},
{
"showname": ".... ..0. .... .... .... .... = LG bit: Globally unique address (factory default)"
},
{
"showname": ".... ...0 .... .... .... .... = IG bit: Individual address (unicast)"
}
]
},
{
"showname": "Type: IP (0x0800)"
}
]
},
{
"showname": "Internet Protocol Version 4, Src: 192.168.0.107 (192.168.0.107), Dst: 74.125.128.19 (74.125.128.19)",
"fields": [
{
"showname": "Version: 4"
},
{
"showname": "Header length: 20 bytes"
},
{
"showname": "Differentiated Services Field: 0x00 (DSCP 0x00: Default; ECN: 0x00: Not-ECT (Not ECN-Capable Transport))",
"fields": [
{
"showname": "0000 00.. = Differentiated Services Codepoint: Default (0x00)"
},
{
"showname": ".... ..00 = Explicit Congestion Notification: Not-ECT (Not ECN-Capable Transport) (0x00)"
}
]
},
{
"showname": "Total Length: 1470"
},
{
"showname": "Identification: 0xb650 (46672)"
},
{
"showname": "Flags: 0x02 (Don't Fragment)",
"fields": [
{
"showname": "0... .... = Reserved bit: Not set"
},
{
"showname": ".1.. .... = Don't fragment: Set"
},
{
"showname": "..0. .... = More fragments: Not set"
}
]
},
{
"showname": "Fragment offset: 0"
},
{
"showname": "Time to live: 64"
},
{
"showname": "Protocol: TCP (6)"
},
{
"showname": "Header checksum: 0xf345 [correct]",
"fields": [
{
"showname": "[Good: True]"
},
{
"showname": "[Bad: False]"
}
]
},
{
"showname": "Source: 192.168.0.107 (192.168.0.107)"
},
{
"showname": "Destination: 74.125.128.19 (74.125.128.19)"
}
]
},
{
"showname": "Transmission Control Protocol, Src Port: 55553 (55553), Dst Port: https (443), Seq: 1, Ack: 1, Len: 1430",
"fields": [
{
"showname": "Source port: 55553 (55553)"
},
{
"showname": "Destination port: https (443)"
},
{
"showname": "[Stream index: 1]"
},
{
"showname": "[TCP Segment Len: 1430]"
},
{
"showname": "Sequence number: 1    (relative sequence number)"
},
{
"showname": "[Next sequence number: 1431    (relative sequence number)]"
},
{
"showname": "Acknowledgment number: 1    (relative ack number)"
},
{
"showname": "Header length: 20 bytes"
},
{
"showname": "Flags: 0x010 (ACK)",
"fields": [
{
"showname": "000. .... .... = Reserved: Not set"
},
{
"showname": "...0 .... .... = Nonce: Not set"
},
{
"showname": ".... 0... .... = Congestion Window Reduced (CWR): Not set"
},
{
"showname": ".... .0.. .... = ECN-Echo: Not set"
},
{
"showname": ".... ..0. .... = Urgent: Not set"
},
{
"showname": ".... ...1 .... = Acknowledgment: Set"
},
{
"showname": ".... .... 0... = Push: Not set"
},
{
"showname": ".... .... .0.. = Reset: Not set"
},
{
"showname": ".... .... ..0. = Syn: Not set"
},
{
"showname": ".... .... ...0 = Fin: Not set"
}
]
},
{
"showname": "Window size value: 316"
},
{
"showname": "[Calculated window size: 316]"
},
{
"showname": "[Window size scaling factor: -1 (unknown)]"
},
{
"showname": "Checksum: 0xb738 [validation disabled]",
"fields": [
{
"showname": "[Good Checksum: False]"
},
{
"showname": "[Bad Checksum: False]"
}
]
},
{
"showname": "Urgent pointer: 0"
},
{
"showname": "[SEQ/ACK analysis]",
"fields": [
{
"showname": "[Bytes in flight: 1430]"
}
]
},
{
"showname": "TCP segment data (1430 bytes)"
}
]
},
{
"showname": "Secure Sockets Layer"
}
]
}
{
"protocols": [
{
"showname": "Frame 8: 1484 bytes on wire (11872 bits), 1484 bytes captured (11872 bits) on interface 0",
"fields": [
{
"showname": "Interface id: 0"
},
{
"showname": "Encapsulation type: Ethernet (1)"
},
{
"showname": "Arrival Time: Sep 19, 2013 17:54:10.180803000 PDT"
},
{
"showname": "[Time shift for this packet: 0.000000000 seconds]"
},
{
"showname": "Epoch Time: 1379638450.180803000 seconds"
},
{
"showname": "[Time delta from previous captured frame: 0.156725000 seconds]"
},
{
"showname": "[Time delta from previous displayed frame: 0.156725000 seconds]"
},
{
"showname": "[Time since reference or first frame: 0.716724000 seconds]"
},
{
"showname": "Frame Number: 8"
},
{
"showname": "Frame Length: 1484 bytes (11872 bits)"
},
{
"showname": "Capture Length: 1484 bytes (11872 bits)"
},
{
"showname": "[Frame is marked: False]"
},
{
"showname": "[Frame is ignored: False]"
},
{
"showname": "[Protocols in frame: eth:ip:tcp:ssl]"
}
]
},
{
"showname": "Ethernet II, Src: 00:21:6a:6e:55:d4 (00:21:6a:6e:55:d4), Dst: 1c:7e:e5:94:c1:fc (1c:7e:e5:94:c1:fc)",
"fields": [
{
"showname": "Destination: 1c:7e:e5:94:c1:fc (1c:7e:e5:94:c1:fc)",
"fields": [
{
"showname": "Address: 1c:7e:e5:94:c1:fc (1c:7e:e5:94:c1:fc)"
},
{
"showname": ".... ..0. .... .... .... .... = LG bit: Globally unique address (factory default)"
},
{
"showname": ".... ...0 .... .... .... .... = IG bit: Individual address (unicast)"
}
]
},
{
"showname": "Source: 00:21:6a:6e:55:d4 (00:21:6a:6e:55:d4)",
"fields": [
{
"showname": "Address: 00:21:6a:6e:55:d4 (00:21:6a:6e:55:d4)"
},
{
"showname": ".... ..0. .... .... .... .... = LG bit: Globally unique address (factory default)"
},
{
"showname": ".... ...0 .... .... .... .... = IG bit: Individual address (unicast)"
}
]
},
{
"showname": "Type: IP (0x0800)"
}
]
},
{
"showname": "Internet Protocol Version 4, Src: 192.168.0.107 (192.168.0.107), Dst: 74.125.128.102 (74.125.128.102)",
"fields": [
{
"showname": "Version: 4"
},
{
"showname": "Header length: 20 bytes"
},
{
"showname": "Differentiated Services Field: 0x00 (DSCP 0x00: Default; ECN: 0x00: Not-ECT (Not ECN-Capable Transport))",
"fields": [
{
"showname": "0000 00.. = Differentiated Services Codepoint: Default (0x00)"
},
{
"showname": ".... ..00 = Explicit Congestion Notification: Not-ECT (Not ECN-Capable Transport) (0x00)"
}
]
},
{
"showname": "Total Length: 1470"
},
{
"showname": "Identification: 0x45d1 (17873)"
},
{
"showname": "Flags: 0x02 (Don't Fragment)",
"fields": [
{
"showname": "0... .... = Reserved bit: Not set"
},
{
"showname": ".1.. .... = Don't fragment: Set"
},
{
"showname": "..0. .... = More fragments: Not set"
}
]
},
{
"showname": "Fragment offset: 0"
},
{
"showname": "Time to live: 64"
},
{
"showname": "Protocol: TCP (6)"
},
{
"showname": "Header checksum: 0x6372 [correct]",
"fields": [
{
"showname": "[Good: True]"
},
{
"showname": "[Bad: False]"
}
]
},
{
"showname": "Source: 192.168.0.107 (192.168.0.107)"
},
{
"showname": "Destination: 74.125.128.102 (74.125.128.102)"
}
]
},
{
"showname": "Transmission Control Protocol, Src Port: 39752 (39752), Dst Port: https (443), Seq: 1, Ack: 194, Len: 1430",
"fields": [
{
"showname": "Source port: 39752 (39752)"
},
{
"showname": "Destination port: https (443)"
},
{
"showname": "[Stream index: 0]"
},
{
"showname": "[TCP Segment Len: 1430]"
},
{
"showname": "Sequence number: 1    (relative sequence number)"
},
{
"showname": "[Next sequence number: 1431    (relative sequence number)]"
},
{
"showname": "Acknowledgment number: 194    (relative ack number)"
},
{
"showname": "Header length: 20 bytes"
},
{
"showname": "Flags: 0x010 (ACK)",
"fields": [
{
"showname": "000. .... .... = Reserved: Not set"
},
{
"showname": "...0 .... .... = Nonce: Not set"
},
{
"showname": ".... 0... .... = Congestion Window Reduced (CWR): Not set"
},
{
"showname": ".... .0.. .... = ECN-Echo: Not set"
},
{
"showname": ".... ..0. .... = Urgent: Not set"
},
{
"showname": ".... ...1 .... = Acknowledgment: Set"
},
{
"showname": ".... .... 0... = Push: Not set"
},
{
"showname": ".... .... .0.. = Reset: Not set"
},
{
"showname": ".... .... ..0. = Syn: Not set"
},
{
"showname": ".... .... ...0 = Fin: Not set"
}
]
},
{
"showname": "Window size value: 1146"
},
{
"showname": "[Calculated window size: 1146]"
},
{
"showname": "[Window size scaling factor: -1 (unknown)]"
},
{
"showname": "Checksum: 0xae73 [validation disabled]",
"fields": [
{
"showname": "[Good Checksum: False]"
},
{
"showname": "[Bad Checksum: False]"
}
]
},
{
"showname": "Urgent pointer: 0"
},
{
"showname": "[SEQ/ACK analysis]",
"fields": [
{
"showname": "[Bytes in flight: 1430]"
}
]
},
{
"showname": "TCP segment data (1430 bytes)"
}
]
},
{
"showname": "Secure Sockets Layer"
}
]
}
{
"protocols": [
{
"showname": "Frame 9: 874 bytes on wire (6992 bits), 874 bytes captured (6992 bits) on interface 0",
"fields": [
{
"showname": "Interface id: 0"
},
{
"showname": "Encapsulation type: Ethernet (1)"
},
{
"showname": "Arrival Time: Sep 19, 2013 17:54:10.180861000 PDT"
},
{
"showname": "[Time shift for this packet: 0.000000000 seconds]"
},
{
"showname": "Epoch Time: 1379638450.180861000 seconds"
},
{
"showname": "[Time delta from previous captured frame: 0.000058000 seconds]"
},
{
"showname": "[Time delta from previous displayed frame: 0.000058000 seconds]"
},
{
"showname": "[Time since reference or first frame: 0.716782000 seconds]"
},
{
"showname": "Frame Number: 9"
},
{
"showname": "Frame Length: 874 bytes (6992 bits)"
},
{
"showname": "Capture Length: 874 bytes (6992 bits)"
},
{
"showname": "[Frame is marked: False]"
},
{
"showname": "[Frame is ignored: False]"
},
{
"showname": "[Protocols in frame: eth:ip:tcp:ssl]"
}
]
},
{
"showname": "Ethernet II, Src: 00:21:6a:6e:55:d4 (00:21:6a:6e:55:d4), Dst: 1c:7e:e5:94:c1:fc (1c:7e:e5:94:c1:fc)",
"fields": [
{
"showname": "Destination: 1c:7e:e5:94:c1:fc (1c:7e:e5:94:c1:fc)",
"fields": [
{
"showname": "Address: 1c:7e:e5:94:c1:fc (1c:7e:e5:94:c1:fc)"
},
{
"showname": ".... ..0. .... .... .... .... = LG bit: Globally unique address (factory default)"
},
{
"showname": ".... ...0 .... .... .... .... = IG bit: Individual address (unicast)"
}
]
},
{
"showname": "Source: 00:21:6a:6e:55:d4 (00:21:6a:6e:55:d4)",
"fields": [
{
"showname": "Address: 00:21:6a:6e:55:d4 (00:21:6a:6e:55:d4)"
},
{
"showname": ".... ..0. .... .... .... .... = LG bit: Globally unique address (factory default)"
},
{
"showname": ".... ...0 .... .... .... .... = IG bit: Individual address (unicast)"
}
]
},
{
"showname": "Type: IP (0x0800)"
}
]
},
{
"showname": "Internet Protocol Version 4, Src: 192.168.0.107 (192.168.0.107), Dst: 74.125.128.102 (74.125.128.102)",
"fields": [
{
"showname": "Version: 4"
},
{
"showname": "Header length: 20 bytes"
},
{
"showname": "Differentiated Services Field: 0x00 (DSCP 0x00: Default; ECN: 0x00: Not-ECT (Not ECN-Capable Transport))",
"fields": [
{
"showname": "0000 00.. = Differentiated Services Codepoint: Default (0x00)"
},
{
"showname": ".... ..00 = Explicit Congestion Notification: Not-ECT (Not ECN-Capable Transport) (0x00)"
}
]
},
{
"showname": "Total Length: 860"
},
{
"showname": "Identification: 0x45d2 (17874)"
},
{
"showname": "Flags: 0x02 (Don't Fragment)",
"fields": [
{
"showname": "0... .... = Reserved bit: Not set"
},
{
"showname": ".1.. .... = Don't fragment: Set"
},
{
"showname": "..0. .... = More fragments: Not set"
}
]
},
{
"showname": "Fragment offset: 0"
},
{
"showname": "Time to live: 64"
},
{
"showname": "Protocol: TCP (6)"
},
{
"showname": "Header checksum: 0x65d3 [correct]",
"fields": [
{
"showname": "[Good: True]"
},
{
"showname": "[Bad: False]"
}
]
},
{
"showname": "Source: 192.168.0.107 (192.168.0.107)"
},
{
"showname": "Destination: 74.125.128.102 (74.125.128.102)"
}
]
},
{
"showname": "Transmission Control Protocol, Src Port: 39752 (39752), Dst Port: https (443), Seq: 1431, Ack: 194, Len: 820",
"fields": [
{
"showname": "Source port: 39752 (39752)"
},
{
"showname": "Destination port: https (443)"
},
{
"showname": "[Stream index: 0]"
},
{
"showname": "[TCP Segment Len: 820]"
},
{
"showname": "Sequence number: 1431    (relative sequence number)"
},
{
"showname": "[Next sequence number: 2251    (relative sequence number)]"
},
{
"showname": "Acknowledgment number: 194    (relative ack number)"
},
{
"showname": "Header length: 20 bytes"
},
{
"showname": "Flags: 0x018 (PSH, ACK)",
"fields": [
{
"showname": "000. .... .... = Reserved: Not set"
},
{
"showname": "...0 .... .... = Nonce: Not set"
},
{
"showname": ".... 0... .... = Congestion Window Reduced (CWR): Not set"
},
{
"showname": ".... .0.. .... = ECN-Echo: Not set"
},
{
"showname": ".... ..0. .... = Urgent: Not set"
},
{
"showname": ".... ...1 .... = Acknowledgment: Set"
},
{
"showname": ".... .... 1... = Push: Set"
},
{
"showname": ".... .... .0.. = Reset: Not set"
},
{
"showname": ".... .... ..0. = Syn: Not set"
},
{
"showname": ".... .... ...0 = Fin: Not set"
}
]
},
{
"showname": "Window size value: 1146"
},
{
"showname": "[Calculated window size: 1146]"
},
{
"showname": "[Window size scaling factor: -1 (unknown)]"
},
{
"showname": "Checksum: 0x939b [validation disabled]",
"fields": [
{
"showname": "[Good Checksum: False]"
},
{
"showname": "[Bad Checksum: False]"
}
]
},
{
"showname": "Urgent pointer: 0"
},
{
"showname": "[SEQ/ACK analysis]",
"fields": [
{
"showname": "[Bytes in flight: 2250]"
}
]
},
{
"showname": "TCP segment data (820 bytes)"
}
]
},
{
"showname": "[2 Reassembled TCP Segments (2250 bytes): #8(1430), #9(820)]",
"fields": [
{
"showname": "[Frame: 8, payload: 0-1429 (1430 bytes)]"
},
{
"showname": "[Frame: 9, payload: 1430-2249 (820 bytes)]"
},
{
"showname": "[Segment count: 2]"
},
{
"showname": "[Reassembled TCP length: 2250]"
},
{
"showname": "[Reassembled TCP Data: 17030208c5530ff214bc6e5a100b50dbee1e0932de369a86...]"
}
]
},
{
"showname": "Secure Sockets Layer",
"fields": [
{
"showname": "TLSv1.1 Record Layer: Application Data Protocol: http",
"fields": [
{
"showname": "Content Type: Application Data (23)"
},
{
"showname": "Version: TLS 1.1 (0x0302)"
},
{
"showname": "Length: 2245"
},
{
"showname": "Encrypted Application Data: 530ff214bc6e5a100b50dbee1e0932de369a86432f9ef7a3..."
}
]
}
]
}
]
}
{
"protocols": [
{
"showname": "Frame 10: 54 bytes on wire (432 bits), 54 bytes captured (432 bits) on interface 0",
"fields": [
{
"showname": "Interface id: 0"
},
{
"showname": "Encapsulation type: Ethernet (1)"
},
{
"showname": "Arrival Time: Sep 19, 2013 17:54:10.269742000 PDT"
},
{
"showname": "[Time shift for this packet: 0.000000000 seconds]"
},
{
"showname": "Epoch Time: 1379638450.269742000 seconds"
},
{
"showname": "[Time delta from previous captured frame: 0.088881000 seconds]"
},
{
"showname": "[Time delta from previous displayed frame: 0.088881000 seconds]"
},
{
"showname": "[Time since reference or first frame: 0.805663000 seconds]"
},
{
"showname": "Frame Number: 10"
},
{
"showname": "Frame Length: 54 bytes (432 bits)"
},
{
"showname": "Capture Length: 54 bytes (432 bits)"
},
{
"showname": "[Frame is marked: False]"
},
{
"showname": "[Frame is ignored: False]"
},
{
"showname": "[Protocols in frame: eth:ip:tcp]"
}
]
},
{
"showname": "Ethernet II, Src: 1c:7e:e5:94:c1:fc (1c:7e:e5:94:c1:fc), Dst: 00:21:6a:6e:55:d4 (00:21:6a:6e:55:d4)",
"fields": [
{
"showname": "Destination: 00:21:6a:6e:55:d4 (00:21:6a:6e:55:d4)",
"fields": [
{
"showname": "Address: 00:21:6a:6e:55:d4 (00:21:6a:6e:55:d4)"
},
{
"showname": ".... ..0. .... .... .... .... = LG bit: Globally unique address (factory default)"
},
{
"showname": ".... ...0 .... .... .... .... = IG bit: Individual address (unicast)"
}
]
},
{
"showname": "Source: 1c:7e:e5:94:c1:fc (1c:7e:e5:94:c1:fc)",
"fields": [
{
"showname": "Address: 1c:7e:e5:94:c1:fc (1c:7e:e5:94:c1:fc)"
},
{
"showname": ".... ..0. .... .... .... .... = LG bit: Globally unique address (factory default)"
},
{
"showname": ".... ...0 .... .... .... .... = IG bit: Individual address (unicast)"
}
]
},
{
"showname": "Type: IP (0x0800)"
}
]
},
{
"showname": "Internet Protocol Version 4, Src: 74.125.128.102 (74.125.128.102), Dst: 192.168.0.107 (192.168.0.107)",
"fields": [
{
"showname": "Version: 4"
},
{
"showname": "Header length: 20 bytes"
},
{
"showname": "Differentiated Services Field: 0x00 (DSCP 0x00: Default; ECN: 0x00: Not-ECT (Not ECN-Capable Transport))",
"fields": [
{
"showname": "0000 00.. = Differentiated Services Codepoint: Default (0x00)"
},
{
"showname": ".... ..00 = Explicit Congestion Notification: Not-ECT (Not ECN-Capable Transport) (0x00)"
}
]
},
{
"showname": "Total Length: 40"
},
{
"showname": "Identification: 0x94f0 (38128)"
},
{
"showname": "Flags: 0x00",
"fields": [
{
"showname": "0... .... = Reserved bit: Not set"
},
{
"showname": ".0.. .... = Don't fragment: Not set"
},
{
"showname": "..0. .... = More fragments: Not set"
}
]
},
{
"showname": "Fragment offset: 0"
},
{
"showname": "Time to live: 41"
},
{
"showname": "Protocol: TCP (6)"
},
{
"showname": "Header checksum: 0x70e9 [correct]",
"fields": [
{
"showname": "[Good: True]"
},
{
"showname": "[Bad: False]"
}
]
},
{
"showname": "Source: 74.125.128.102 (74.125.128.102)"
},
{
"showname": "Destination: 192.168.0.107 (192.168.0.107)"
}
]
},
{
"showname": "Transmission Control Protocol, Src Port: https (443), Dst Port: 39752 (39752), Seq: 194, Ack: 1431, Len: 0",
"fields": [
{
"showname": "Source port: https (443)"
},
{
"showname": "Destination port: 39752 (39752)"
},
{
"showname": "[Stream index: 0]"
},
{
"showname": "[TCP Segment Len: 0]"
},
{
"showname": "Sequence number: 194    (relative sequence number)"
},
{
"showname": "Acknowledgment number: 1431    (relative ack number)"
},
{
"showname": "Header length: 20 bytes"
},
{
"showname": "Flags: 0x010 (ACK)",
"fields": [
{
"showname": "000. .... .... = Reserved: Not set"
},
{
"showname": "...0 .... .... = Nonce: Not set"
},
{
"showname": ".... 0... .... = Congestion Window Reduced (CWR): Not set"
},
{
"showname": ".... .0.. .... = ECN-Echo: Not set"
},
{
"showname": ".... ..0. .... = Urgent: Not set"
},
{
"showname": ".... ...1 .... = Acknowledgment: Set"
},
{
"showname": ".... .... 0... = Push: Not set"
},
{
"showname": ".... .... .0.. = Reset: Not set"
},
{
"showname": ".... .... ..0. = Syn: Not set"
},
{
"showname": ".... .... ...0 = Fin: Not set"
}
]
},
{
"showname": "Window size value: 1341"
},
{
"showname": "[Calculated window size: 1341]"
},
{
"showname": "[Window size scaling factor: -1 (unknown)]"
},
{
"showname": "Checksum: 0x2d37 [validation disabled]",
"fields": [
{
"showname": "[Good Checksum: False]"
},
{
"showname": "[Bad Checksum: False]"
}
]
},
{
"showname": "Urgent pointer: 0"
},
{
"showname": "[SEQ/ACK analysis]",
"fields": [
{
"showname": "[This is an ACK to the segment in frame: 8]"
},
{
"showname": "[The RTT to ACK the segment was: 0.088939000 seconds]"
}
]
}
]
}
]
}
{
"protocols": [
{
"showname": "Frame 11: 54 bytes on wire (432 bits), 54 bytes captured (432 bits) on interface 0",
"fields": [
{
"showname": "Interface id: 0"
},
{
"showname": "Encapsulation type: Ethernet (1)"
},
{
"showname": "Arrival Time: Sep 19, 2013 17:54:10.269764000 PDT"
},
{
"showname": "[Time shift for this packet: 0.000000000 seconds]"
},
{
"showname": "Epoch Time: 1379638450.269764000 seconds"
},
{
"showname": "[Time delta from previous captured frame: 0.000022000 seconds]"
},
{
"showname": "[Time delta from previous displayed frame: 0.000022000 seconds]"
},
{
"showname": "[Time since reference or first frame: 0.805685000 seconds]"
},
{
"showname": "Frame Number: 11"
},
{
"showname": "Frame Length: 54 bytes (432 bits)"
},
{
"showname": "Capture Length: 54 bytes (432 bits)"
},
{
"showname": "[Frame is marked: False]"
},
{
"showname": "[Frame is ignored: False]"
},
{
"showname": "[Protocols in frame: eth:ip:tcp]"
}
]
},
{
"showname": "Ethernet II, Src: 1c:7e:e5:94:c1:fc (1c:7e:e5:94:c1:fc), Dst: 00:21:6a:6e:55:d4 (00:21:6a:6e:55:d4)",
"fields": [
{
"showname": "Destination: 00:21:6a:6e:55:d4 (00:21:6a:6e:55:d4)",
"fields": [
{
"showname": "Address: 00:21:6a:6e:55:d4 (00:21:6a:6e:55:d4)"
},
{
"showname": ".... ..0. .... .... .... .... = LG bit: Globally unique address (factory default)"
},
{
"showname": ".... ...0 .... .... .... .... = IG bit: Individual address (unicast)"
}
]
},
{
"showname": "Source: 1c:7e:e5:94:c1:fc (1c:7e:e5:94:c1:fc)",
"fields": [
{
"showname": "Address: 1c:7e:e5:94:c1:fc (1c:7e:e5:94:c1:fc)"
},
{
"showname": ".... ..0. .... .... .... .... = LG bit: Globally unique address (factory default)"
},
{
"showname": ".... ...0 .... .... .... .... = IG bit: Individual address (unicast)"
}
]
},
{
"showname": "Type: IP (0x0800)"
}
]
},
{
"showname": "Internet Protocol Version 4, Src: 74.125.128.102 (74.125.128.102), Dst: 192.168.0.107 (192.168.0.107)",
"fields": [
{
"showname": "Version: 4"
},
{
"showname": "Header length: 20 bytes"
},
{
"showname": "Differentiated Services Field: 0x00 (DSCP 0x00: Default; ECN: 0x00: Not-ECT (Not ECN-Capable Transport))",
"fields": [
{
"showname": "0000 00.. = Differentiated Services Codepoint: Default (0x00)"
},
{
"showname": ".... ..00 = Explicit Congestion Notification: Not-ECT (Not ECN-Capable Transport) (0x00)"
}
]
},
{
"showname": "Total Length: 40"
},
{
"showname": "Identification: 0x94f1 (38129)"
},
{
"showname": "Flags: 0x00",
"fields": [
{
"showname": "0... .... = Reserved bit: Not set"
},
{
"showname": ".0.. .... = Don't fragment: Not set"
},
{
"showname": "..0. .... = More fragments: Not set"
}
]
},
{
"showname": "Fragment offset: 0"
},
{
"showname": "Time to live: 41"
},
{
"showname": "Protocol: TCP (6)"
},
{
"showname": "Header checksum: 0x70e8 [correct]",
"fields": [
{
"showname": "[Good: True]"
},
{
"showname": "[Bad: False]"
}
]
},
{
"showname": "Source: 74.125.128.102 (74.125.128.102)"
},
{
"showname": "Destination: 192.168.0.107 (192.168.0.107)"
}
]
},
{
"showname": "Transmission Control Protocol, Src Port: https (443), Dst Port: 39752 (39752), Seq: 194, Ack: 2251, Len: 0",
"fields": [
{
"showname": "Source port: https (443)"
},
{
"showname": "Destination port: 39752 (39752)"
},
{
"showname": "[Stream index: 0]"
},
{
"showname": "[TCP Segment Len: 0]"
},
{
"showname": "Sequence number: 194    (relative sequence number)"
},
{
"showname": "Acknowledgment number: 2251    (relative ack number)"
},
{
"showname": "Header length: 20 bytes"
},
{
"showname": "Flags: 0x010 (ACK)",
"fields": [
{
"showname": "000. .... .... = Reserved: Not set"
},
{
"showname": "...0 .... .... = Nonce: Not set"
},
{
"showname": ".... 0... .... = Congestion Window Reduced (CWR): Not set"
},
{
"showname": ".... .0.. .... = ECN-Echo: Not set"
},
{
"showname": ".... ..0. .... = Urgent: Not set"
},
{
"showname": ".... ...1 .... = Acknowledgment: Set"
},
{
"showname": ".... .... 0... = Push: Not set"
},
{
"showname": ".... .... .0.. = Reset: Not set"
},
{
"showname": ".... .... ..0. = Syn: Not set"
},
{
"showname": ".... .... ...0 = Fin: Not set"
}
]
},
{
"showname": "Window size value: 1341"
},
{
"showname": "[Calculated window size: 1341]"
},
{
"showname": "[Window size scaling factor: -1 (unknown)]"
},
{
"showname": "Checksum: 0x2a03 [validation disabled]",
"fields": [
{
"showname": "[Good Checksum: False]"
},
{
"showname": "[Bad Checksum: False]"
}
]
},
{
"showname": "Urgent pointer: 0"
},
{
"showname": "[SEQ/ACK analysis]",
"fields": [
{
"showname": "[This is an ACK to the segment in frame: 9]"
},
{
"showname": "[The RTT to ACK the segment was: 0.088903000 seconds]"
}
]
}
]
}
]
}
{
"protocols": [
{
"showname": "Frame 12: 107 bytes on wire (856 bits), 107 bytes captured (856 bits) on interface 0",
"fields": [
{
"showname": "Interface id: 0"
},
{
"showname": "Encapsulation type: Ethernet (1)"
},
{
"showname": "Arrival Time: Sep 19, 2013 17:54:10.428601000 PDT"
},
{
"showname": "[Time shift for this packet: 0.000000000 seconds]"
},
{
"showname": "Epoch Time: 1379638450.428601000 seconds"
},
{
"showname": "[Time delta from previous captured frame: 0.158837000 seconds]"
},
{
"showname": "[Time delta from previous displayed frame: 0.158837000 seconds]"
},
{
"showname": "[Time since reference or first frame: 0.964522000 seconds]"
},
{
"showname": "Frame Number: 12"
},
{
"showname": "Frame Length: 107 bytes (856 bits)"
},
{
"showname": "Capture Length: 107 bytes (856 bits)"
},
{
"showname": "[Frame is marked: False]"
},
{
"showname": "[Frame is ignored: False]"
},
{
"showname": "[Protocols in frame: eth:ip:tcp:ssl]"
}
]
},
{
"showname": "Ethernet II, Src: 1c:7e:e5:94:c1:fc (1c:7e:e5:94:c1:fc), Dst: 00:21:6a:6e:55:d4 (00:21:6a:6e:55:d4)",
"fields": [
{
"showname": "Destination: 00:21:6a:6e:55:d4 (00:21:6a:6e:55:d4)",
"fields": [
{
"showname": "Address: 00:21:6a:6e:55:d4 (00:21:6a:6e:55:d4)"
},
{
"showname": ".... ..0. .... .... .... .... = LG bit: Globally unique address (factory default)"
},
{
"showname": ".... ...0 .... .... .... .... = IG bit: Individual address (unicast)"
}
]
},
{
"showname": "Source: 1c:7e:e5:94:c1:fc (1c:7e:e5:94:c1:fc)",
"fields": [
{
"showname": "Address: 1c:7e:e5:94:c1:fc (1c:7e:e5:94:c1:fc)"
},
{
"showname": ".... ..0. .... .... .... .... = LG bit: Globally unique address (factory default)"
},
{
"showname": ".... ...0 .... .... .... .... = IG bit: Individual address (unicast)"
}
]
},
{
"showname": "Type: IP (0x0800)"
}
]
},
{
"showname": "Internet Protocol Version 4, Src: 74.125.128.102 (74.125.128.102), Dst: 192.168.0.107 (192.168.0.107)",
"fields": [
{
"showname": "Version: 4"
},
{
"showname": "Header length: 20 bytes"
},
{
"showname": "Differentiated Services Field: 0x00 (DSCP 0x00: Default; ECN: 0x00: Not-ECT (Not ECN-Capable Transport))",
"fields": [
{
"showname": "0000 00.. = Differentiated Services Codepoint: Default (0x00)"
},
{
"showname": ".... ..00 = Explicit Congestion Notification: Not-ECT (Not ECN-Capable Transport) (0x00)"
}
]
},
{
"showname": "Total Length: 93"
},
{
"showname": "Identification: 0x94f2 (38130)"
},
{
"showname": "Flags: 0x00",
"fields": [
{
"showname": "0... .... = Reserved bit: Not set"
},
{
"showname": ".0.. .... = Don't fragment: Not set"
},
{
"showname": "..0. .... = More fragments: Not set"
}
]
},
{
"showname": "Fragment offset: 0"
},
{
"showname": "Time to live: 41"
},
{
"showname": "Protocol: TCP (6)"
},
{
"showname": "Header checksum: 0x70b2 [correct]",
"fields": [
{
"showname": "[Good: True]"
},
{
"showname": "[Bad: False]"
}
]
},
{
"showname": "Source: 74.125.128.102 (74.125.128.102)"
},
{
"showname": "Destination: 192.168.0.107 (192.168.0.107)"
}
]
},
{
"showname": "Transmission Control Protocol, Src Port: https (443), Dst Port: 39752 (39752), Seq: 194, Ack: 2251, Len: 53",
"fields": [
{
"showname": "Source port: https (443)"
},
{
"showname": "Destination port: 39752 (39752)"
},
{
"showname": "[Stream index: 0]"
},
{
"showname": "[TCP Segment Len: 53]"
},
{
"showname": "Sequence number: 194    (relative sequence number)"
},
{
"showname": "[Next sequence number: 247    (relative sequence number)]"
},
{
"showname": "Acknowledgment number: 2251    (relative ack number)"
},
{
"showname": "Header length: 20 bytes"
},
{
"showname": "Flags: 0x018 (PSH, ACK)",
"fields": [
{
"showname": "000. .... .... = Reserved: Not set"
},
{
"showname": "...0 .... .... = Nonce: Not set"
},
{
"showname": ".... 0... .... = Congestion Window Reduced (CWR): Not set"
},
{
"showname": ".... .0.. .... = ECN-Echo: Not set"
},
{
"showname": ".... ..0. .... = Urgent: Not set"
},
{
"showname": ".... ...1 .... = Acknowledgment: Set"
},
{
"showname": ".... .... 1... = Push: Set"
},
{
"showname": ".... .... .0.. = Reset: Not set"
},
{
"showname": ".... .... ..0. = Syn: Not set"
},
{
"showname": ".... .... ...0 = Fin: Not set"
}
]
},
{
"showname": "Window size value: 1341"
},
{
"showname": "[Calculated window size: 1341]"
},
{
"showname": "[Window size scaling factor: -1 (unknown)]"
},
{
"showname": "Checksum: 0x68a4 [validation disabled]",
"fields": [
{
"showname": "[Good Checksum: False]"
},
{
"showname": "[Bad Checksum: False]"
}
]
},
{
"showname": "Urgent pointer: 0"
},
{
"showname": "[SEQ/ACK analysis]",
"fields": [
{
"showname": "[Bytes in flight: 53]"
}
]
}
]
},
{
"showname": "Secure Sockets Layer",
"fields": [
{
"showname": "TLSv1.1 Record Layer: Application Data Protocol: http",
"fields": [
{
"showname": "Content Type: Application Data (23)"
},
{
"showname": "Version: TLS 1.1 (0x0302)"
},
{
"showname": "Length: 48"
},
{
"showname": "Encrypted Application Data: ea8d43ecd7ec0eecb1b59e1935777f520eda02c132dfa544..."
}
]
}
]
}
]
}
{
"protocols": [
{
"showname": "Frame 13: 54 bytes on wire (432 bits), 54 bytes captured (432 bits) on interface 0",
"fields": [
{
"showname": "Interface id: 0"
},
{
"showname": "Encapsulation type: Ethernet (1)"
},
{
"showname": "Arrival Time: Sep 19, 2013 17:54:10.428620000 PDT"
},
{
"showname": "[Time shift for this packet: 0.000000000 seconds]"
},
{
"showname": "Epoch Time: 1379638450.428620000 seconds"
},
{
"showname": "[Time delta from previous captured frame: 0.000019000 seconds]"
},
{
"showname": "[Time delta from previous displayed frame: 0.000019000 seconds]"
},
{
"showname": "[Time since reference or first frame: 0.964541000 seconds]"
},
{
"showname": "Frame Number: 13"
},
{
"showname": "Frame Length: 54 bytes (432 bits)"
},
{
"showname": "Capture Length: 54 bytes (432 bits)"
},
{
"showname": "[Frame is marked: False]"
},
{
"showname": "[Frame is ignored: False]"
},
{
"showname": "[Protocols in frame: eth:ip:tcp]"
}
]
},
{
"showname": "Ethernet II, Src: 00:21:6a:6e:55:d4 (00:21:6a:6e:55:d4), Dst: 1c:7e:e5:94:c1:fc (1c:7e:e5:94:c1:fc)",
"fields": [
{
"showname": "Destination: 1c:7e:e5:94:c1:fc (1c:7e:e5:94:c1:fc)",
"fields": [
{
"showname": "Address: 1c:7e:e5:94:c1:fc (1c:7e:e5:94:c1:fc)"
},
{
"showname": ".... ..0. .... .... .... .... = LG bit: Globally unique address (factory default)"
},
{
"showname": ".... ...0 .... .... .... .... = IG bit: Individual address (unicast)"
}
]
},
{
"showname": "Source: 00:21:6a:6e:55:d4 (00:21:6a:6e:55:d4)",
"fields": [
{
"showname": "Address: 00:21:6a:6e:55:d4 (00:21:6a:6e:55:d4)"
},
{
"showname": ".... ..0. .... .... .... .... = LG bit: Globally unique address (factory default)"
},
{
"showname": ".... ...0 .... .... .... .... = IG bit: Individual address (unicast)"
}
]
},
{
"showname": "Type: IP (0x0800)"
}
]
},
{
"showname": "Internet Protocol Version 4, Src: 192.168.0.107 (192.168.0.107), Dst: 74.125.128.102 (74.125.128.102)",
"fields": [
{
"showname": "Version: 4"
},
{
"showname": "Header length: 20 bytes"
},
{
"showname": "Differentiated Services Field: 0x00 (DSCP 0x00: Default; ECN: 0x00: Not-ECT (Not ECN-Capable Transport))",
"fields": [
{
"showname": "0000 00.. = Differentiated Services Codepoint: Default (0x00)"
},
{
"showname": ".... ..00 = Explicit Congestion Notification: Not-ECT (Not ECN-Capable Transport) (0x00)"
}
]
},
{
"showname": "Total Length: 40"
},
{
"showname": "Identification: 0x45d3 (17875)"
},
{
"showname": "Flags: 0x02 (Don't Fragment)",
"fields": [
{
"showname": "0... .... = Reserved bit: Not set"
},
{
"showname": ".1.. .... = Don't fragment: Set"
},
{
"showname": "..0. .... = More fragments: Not set"
}
]
},
{
"showname": "Fragment offset: 0"
},
{
"showname": "Time to live: 64"
},
{
"showname": "Protocol: TCP (6)"
},
{
"showname": "Header checksum: 0x6906 [correct]",
"fields": [
{
"showname": "[Good: True]"
},
{
"showname": "[Bad: False]"
}
]
},
{
"showname": "Source: 192.168.0.107 (192.168.0.107)"
},
{
"showname": "Destination: 74.125.128.102 (74.125.128.102)"
}
]
},
{
"showname": "Transmission Control Protocol, Src Port: 39752 (39752), Dst Port: https (443), Seq: 2251, Ack: 247, Len: 0",
"fields": [
{
"showname": "Source port: 39752 (39752)"
},
{
"showname": "Destination port: https (443)"
},
{
"showname": "[Stream index: 0]"
},
{
"showname": "[TCP Segment Len: 0]"
},
{
"showname": "Sequence number: 2251    (relative sequence number)"
},
{
"showname": "Acknowledgment number: 247    (relative ack number)"
},
{
"showname": "Header length: 20 bytes"
},
{
"showname": "Flags: 0x010 (ACK)",
"fields": [
{
"showname": "000. .... .... = Reserved: Not set"
},
{
"showname": "...0 .... .... = Nonce: Not set"
},
{
"showname": ".... 0... .... = Congestion Window Reduced (CWR): Not set"
},
{
"showname": ".... .0.. .... = ECN-Echo: Not set"
},
{
"showname": ".... ..0. .... = Urgent: Not set"
},
{
"showname": ".... ...1 .... = Acknowledgment: Set"
},
{
"showname": ".... .... 0... = Push: Not set"
},
{
"showname": ".... .... .0.. = Reset: Not set"
},
{
"showname": ".... .... ..0. = Syn: Not set"
},
{
"showname": ".... .... ...0 = Fin: Not set"
}
]
},
{
"showname": "Window size value: 1146"
},
{
"showname": "[Calculated window size: 1146]"
},
{
"showname": "[Window size scaling factor: -1 (unknown)]"
},
{
"showname": "Checksum: 0x8c11 [validation disabled]",
"fields": [
{
"showname": "[Good Checksum: False]"
},
{
"showname": "[Bad Checksum: False]"
}
]
},
{
"showname": "Urgent pointer: 0"
},
{
"showname": "[SEQ/ACK analysis]",
"fields": [
{
"showname": "[This is an ACK to the segment in frame: 12]"
},
{
"showname": "[The RTT to ACK the segment was: 0.000019000 seconds]"
}
]
}
]
}
]
}
{
"protocols": [
{
"showname": "Frame 14: 108 bytes on wire (864 bits), 108 bytes captured (864 bits) on interface 0",
"fields": [
{
"showname": "Interface id: 0"
},
{
"showname": "Encapsulation type: Ethernet (1)"
},
{
"showname": "Arrival Time: Sep 19, 2013 17:54:10.428642000 PDT"
},
{
"showname": "[Time shift for this packet: 0.000000000 seconds]"
},
{
"showname": "Epoch Time: 1379638450.428642000 seconds"
},
{
"showname": "[Time delta from previous captured frame: 0.000022000 seconds]"
},
{
"showname": "[Time delta from previous displayed frame: 0.000022000 seconds]"
},
{
"showname": "[Time since reference or first frame: 0.964563000 seconds]"
},
{
"showname": "Frame Number: 14"
},
{
"showname": "Frame Length: 108 bytes (864 bits)"
},
{
"showname": "Capture Length: 108 bytes (864 bits)"
},
{
"showname": "[Frame is marked: False]"
},
{
"showname": "[Frame is ignored: False]"
},
{
"showname": "[Protocols in frame: eth:ip:tcp:ssl]"
}
]
},
{
"showname": "Ethernet II, Src: 1c:7e:e5:94:c1:fc (1c:7e:e5:94:c1:fc), Dst: 00:21:6a:6e:55:d4 (00:21:6a:6e:55:d4)",
"fields": [
{
"showname": "Destination: 00:21:6a:6e:55:d4 (00:21:6a:6e:55:d4)",
"fields": [
{
"showname": "Address: 00:21:6a:6e:55:d4 (00:21:6a:6e:55:d4)"
},
{
"showname": ".... ..0. .... .... .... .... = LG bit: Globally unique address (factory default)"
},
{
"showname": ".... ...0 .... .... .... .... = IG bit: Individual address (unicast)"
}
]
},
{
"showname": "Source: 1c:7e:e5:94:c1:fc (1c:7e:e5:94:c1:fc)",
"fields": [
{
"showname": "Address: 1c:7e:e5:94:c1:fc (1c:7e:e5:94:c1:fc)"
},
{
"showname": ".... ..0. .... .... .... .... = LG bit: Globally unique address (factory default)"
},
{
"showname": ".... ...0 .... .... .... .... = IG bit: Individual address (unicast)"
}
]
},
{
"showname": "Type: IP (0x0800)"
}
]
},
{
"showname": "Internet Protocol Version 4, Src: 74.125.128.102 (74.125.128.102), Dst: 192.168.0.107 (192.168.0.107)",
"fields": [
{
"showname": "Version: 4"
},
{
"showname": "Header length: 20 bytes"
},
{
"showname": "Differentiated Services Field: 0x00 (DSCP 0x00: Default; ECN: 0x00: Not-ECT (Not ECN-Capable Transport))",
"fields": [
{
"showname": "0000 00.. = Differentiated Services Codepoint: Default (0x00)"
},
{
"showname": ".... ..00 = Explicit Congestion Notification: Not-ECT (Not ECN-Capable Transport) (0x00)"
}
]
},
{
"showname": "Total Length: 94"
},
{
"showname": "Identification: 0x94f3 (38131)"
},
{
"showname": "Flags: 0x00",
"fields": [
{
"showname": "0... .... = Reserved bit: Not set"
},
{
"showname": ".0.. .... = Don't fragment: Not set"
},
{
"showname": "..0. .... = More fragments: Not set"
}
]
},
{
"showname": "Fragment offset: 0"
},
{
"showname": "Time to live: 41"
},
{
"showname": "Protocol: TCP (6)"
},
{
"showname": "Header checksum: 0x70b0 [correct]",
"fields": [
{
"showname": "[Good: True]"
},
{
"showname": "[Bad: False]"
}
]
},
{
"showname": "Source: 74.125.128.102 (74.125.128.102)"
},
{
"showname": "Destination: 192.168.0.107 (192.168.0.107)"
}
]
},
{
"showname": "Transmission Control Protocol, Src Port: https (443), Dst Port: 39752 (39752), Seq: 247, Ack: 2251, Len: 54",
"fields": [
{
"showname": "Source port: https (443)"
},
{
"showname": "Destination port: 39752 (39752)"
},
{
"showname": "[Stream index: 0]"
},
{
"showname": "[TCP Segment Len: 54]"
},
{
"showname": "Sequence number: 247    (relative sequence number)"
},
{
"showname": "[Next sequence number: 301    (relative sequence number)]"
},
{
"showname": "Acknowledgment number: 2251    (relative ack number)"
},
{
"showname": "Header length: 20 bytes"
},
{
"showname": "Flags: 0x018 (PSH, ACK)",
"fields": [
{
"showname": "000. .... .... = Reserved: Not set"
},
{
"showname": "...0 .... .... = Nonce: Not set"
},
{
"showname": ".... 0... .... = Congestion Window Reduced (CWR): Not set"
},
{
"showname": ".... .0.. .... = ECN-Echo: Not set"
},
{
"showname": ".... ..0. .... = Urgent: Not set"
},
{
"showname": ".... ...1 .... = Acknowledgment: Set"
},
{
"showname": ".... .... 1... = Push: Set"
},
{
"showname": ".... .... .0.. = Reset: Not set"
},
{
"showname": ".... .... ..0. = Syn: Not set"
},
{
"showname": ".... .... ...0 = Fin: Not set"
}
]
},
{
"showname": "Window size value: 134115"
},
{
"showname": "[Calculated window size: 1341]"
},
{
"showname": "[Window size scaling factor: -1 (unknown)]"
},
{
"showname": "Checksum: 0x3b4c [validation disabled]",
"fields": [
{
"showname": "[Good Checksum: False]"
},
{
"showname": "[Bad Checksum: False]"
}
]
},
{
"showname": "Urgent pointer: 0"
},
{
"showname": "[SEQ/ACK analysis]",
"fields": [
{
"showname": "[Bytes in flight: 54]"
}
]
}
]
},
{
"showname": "Secure Sockets Layer",
"fields": [
{
"showname": "TLSv1.1 Record Layer: Application Data Protocol: http",
"fields": [
{
"showname": "Content Type: Application Data (23)"
},
{
"showname": "Version: TLS 1.1 (0x0302)"
},
{
"showname": "Length: 49"
},
{
"showname": "Encrypted Application Data: 3017acdd0dcd1120927f099624e66467d334de503544b268..."
}
]
}
]
}
]
}
